[I 2026-07-16 08:20:59,511] Trial 7 finished with value: 0.7844243102117482 and parameters: {'use_max_depth': False, 'use_max_features_cat': False, 'max_features_float': 0.2762277292489188, 'n_estimators': 1250, 'min_samples_leaf': 5}. Best is trial 2 with value: 0.7913818299960927.
Best trial: 2. Best value: 0.791382:  27%|████████████████████████████████████▌                                                                                                    | 8/30 [00:23<01:10,  3.22s/it]2026-07-16 08:20:59 - HeartDisease_RiskDiscovery - INFO - RandomForest initialized with resolved params: {'n_estimators': 950, 'max_depth': 6, 'max_features': 'log2', 'min_samples_leaf': 9, 'class_weight': 'balanced', 'random_state': 44, 'n_jobs': -1}
2026-07-16 08:20:59 - HeartDisease_RiskDiscovery - INFO - Training RandomForest on 44794 samples
2026-07-16 08:21:01 - HeartDisease_RiskDiscovery - INFO - RandomForest training completed
[I 2026-07-16 08:21:01,629] Trial 8 finished with value: 0.7883179539985667 and parameters: {'use_max_depth': True, 'max_depth': 6, 'use_max_features_cat': True, 'max_features': 'log2', 'n_estimators': 950, 'min_samples_leaf': 9}. Best is trial 2 with value: 0.7913818299960927.
Best trial: 2. Best value: 0.791382:  30%|█████████████████████████████████████████                                                                                                | 9/30 [00:25<01:00,  2.87s/it]2026-07-16 08:21:01 - HeartDisease_RiskDiscovery - INFO - RandomForest initialized with resolved params: {'n_estimators': 850, 'max_depth': 29, 'max_features': 0.2871084762323527, 'min_samples_leaf': 14, 'class_weight': 'balanced', 'random_state': 44, 'n_jobs': -1}
2026-07-16 08:21:01 - HeartDisease_RiskDiscovery - INFO - Training RandomForest on 44794 samples
2026-07-16 08:21:04 - HeartDisease_RiskDiscovery - INFO - RandomForest training completed
[I 2026-07-16 08:21:05,015] Trial 9 finished with value: 0.7894424560259116 and parameters: {'use_max_depth': True, 'max_depth': 29, 'use_max_features_cat': False, 'max_features_float': 0.2871084762323527, 'n_estimators': 850, 'min_samples_leaf': 14}. Best is trial 2 with value: 0.7913818299960927.
Best trial: 2. Best value: 0.791382:  33%|█████████████████████████████████████████████▎                                                                                          | 10/30 [00:28<01:00,  3.03s/it]2026-07-16 08:21:05 - HeartDisease_RiskDiscovery - INFO - RandomForest initialized with resolved params: {'n_estimators': 600, 'max_depth': None, 'max_features': 0.9832719859927782, 'min_samples_leaf': 12, 'class_weight': 'balanced', 'random_state': 44, 'n_jobs': -1}
2026-07-16 08:21:05 - HeartDisease_RiskDiscovery - INFO - Training RandomForest on 44794 samples
2026-07-16 08:21:12 - HeartDisease_RiskDiscovery - INFO - RandomForest training completed
[I 2026-07-16 08:21:12,423] Trial 10 finished with value: 0.785924708752982 and parameters: {'use_max_depth': False, 'use_max_features_cat': False, 'max_features_float': 0.9832719859927782, 'n_estimators': 600, 'min_samples_leaf': 12}. Best is trial 2 with value: 0.7913818299960927.
Best trial: 2. Best value: 0.791382:  37%|█████████████████████████████████████████████████▊                                                                                      | 11/30 [00:35<01:23,  4.37s/it]2026-07-16 08:21:12 - HeartDisease_RiskDiscovery - INFO - RandomForest initialized with resolved params: {'n_estimators': 300, 'max_depth': 9, 'max_features': 'log2', 'min_samples_leaf': 3, 'class_weight': 'balanced', 'random_state': 44, 'n_jobs': -1}
2026-07-16 08:21:12 - HeartDisease_RiskDiscovery - INFO - Training RandomForest on 44794 samples
2026-07-16 08:21:13 - HeartDisease_RiskDiscovery - INFO - RandomForest training completed
[I 2026-07-16 08:21:13,360] Trial 11 finished with value: 0.7908378654493305 and parameters: {'use_max_depth': True, 'max_depth': 9, 'use_max_features_cat': True, 'max_features': 'log2', 'n_estimators': 300, 'min_samples_leaf': 3}. Best is trial 2 with value: 0.7913818299960927.
Best trial: 2. Best value: 0.791382:  40%|██████████████████████████████████████████████████████▍                                                                                 | 12/30 [00:36<00:59,  3.33s/it]2026-07-16 08:21:13 - HeartDisease_RiskDiscovery - INFO - RandomForest initialized with resolved params: {'n_estimators': 200, 'max_depth': 13, 'max_features': 'sqrt', 'min_samples_leaf': 11, 'class_weight': 'balanced', 'random_state': 44, 'n_jobs': -1}
2026-07-16 08:21:13 - HeartDisease_RiskDiscovery - INFO - Training RandomForest on 44794 samples
2026-07-16 08:21:13 - HeartDisease_RiskDiscovery - INFO - RandomForest training completed
[I 2026-07-16 08:21:14,025] Trial 12 finished with value: 0.79082797546595 and parameters: {'use_max_depth': True, 'max_depth': 13, 'use_max_features_cat': True, 'max_features': 'sqrt', 'n_estimators': 200, 'min_samples_leaf': 11}. Best is trial 2 with value: 0.7913818299960927.
Best trial: 2. Best value: 0.791382:  43%|██████████████████████████████████████████████████████████▉                                                                             | 13/30 [00:37<00:42,  2.52s/it]2026-07-16 08:21:14 - HeartDisease_RiskDiscovery - INFO - RandomForest initialized with resolved params: {'n_estimators': 500, 'max_depth': 14, 'max_features': 'log2', 'min_samples_leaf': 5, 'class_weight': 'balanced', 'random_state': 44, 'n_jobs': -1}
2026-07-16 08:21:14 - HeartDisease_RiskDiscovery - INFO - Training RandomForest on 44794 samples
2026-07-16 08:21:15 - HeartDisease_RiskDiscovery - INFO - RandomForest training completed
[I 2026-07-16 08:21:15,562] Trial 13 finished with value: 0.7896935090014939 and parameters: {'use_max_depth': True, 'max_depth': 14, 'use_max_features_cat': True, 'max_features': 'log2', 'n_estimators': 500, 'min_samples_leaf': 5}. Best is trial 2 with value: 0.7913818299960927.
Best trial: 2. Best value: 0.791382:  47%|███████████████████████████████████████████████████████████████▍                                                                        | 14/30 [00:39<00:35,  2.22s/it]2026-07-16 08:21:15 - HeartDisease_RiskDiscovery - INFO - RandomForest initialized with resolved params: {'n_estimators': 650, 'max_depth': 12, 'max_features': 'sqrt', 'min_samples_leaf': 10, 'class_weight': 'balanced', 'random_state': 44, 'n_jobs': -1}
2026-07-16 08:21:15 - HeartDisease_RiskDiscovery - INFO - Training RandomForest on 44794 samples
2026-07-16 08:21:17 - HeartDisease_RiskDiscovery - INFO - RandomForest training completed
[I 2026-07-16 08:21:17,334] Trial 14 finished with value: 0.7906947865239483 and parameters: {'use_max_depth': True, 'max_depth': 12, 'use_max_features_cat': True, 'max_features': 'sqrt', 'n_estimators': 650, 'min_samples_leaf': 10}. Best is trial 2 with value: 0.7913818299960927.
Best trial: 2. Best value: 0.791382:  50%|████████████████████████████████████████████████████████████████████                                                                    | 15/30 [00:40<00:31,  2.09s/it]2026-07-16 08:21:17 - HeartDisease_RiskDiscovery - INFO - RandomForest initialized with resolved params: {'n_estimators': 450, 'max_depth': 18, 'max_features': 'log2', 'min_samples_leaf': 5, 'class_weight': 'balanced', 'random_state': 44, 'n_jobs': -1}
2026-07-16 08:21:17 - HeartDisease_RiskDiscovery - INFO - Training RandomForest on 44794 samples
2026-07-16 08:21:18 - HeartDisease_RiskDiscovery - INFO - RandomForest training completed
[I 2026-07-16 08:21:18,917] Trial 15 finished with value: 0.7876035557896501 and parameters: {'use_max_depth': True, 'max_depth': 18, 'use_max_features_cat': True, 'max_features': 'log2', 'n_estimators': 450, 'min_samples_leaf': 5}. Best is trial 2 with value: 0.7913818299960927.
Best trial: 2. Best value: 0.791382:  53%|████████████████████████████████████████████████████████████████████████▌                                                               | 16/30 [00:42<00:27,  1.94s/it]2026-07-16 08:21:18 - HeartDisease_RiskDiscovery - INFO - RandomForest initialized with resolved params: {'n_estimators': 200, 'max_depth': 6, 'max_features': 'sqrt', 'min_samples_leaf': 12, 'class_weight': 'balanced', 'random_state': 44, 'n_jobs': -1}
2026-07-16 08:21:18 - HeartDisease_RiskDiscovery - INFO - Training RandomForest on 44794 samples
2026-07-16 08:21:19 - HeartDisease_RiskDiscovery - INFO - RandomForest training completed
[I 2026-07-16 08:21:19,378] Trial 16 finished with value: 0.788349535868712 and parameters: {'use_max_depth': True, 'max_depth': 6, 'use_max_features_cat': True, 'max_features': 'sqrt', 'n_estimators': 200, 'min_samples_leaf': 12}. Best is trial 2 with value: 0.7913818299960927.
Best trial: 2. Best value: 0.791382:  57%|█████████████████████████████████████████████████████████████████████████████                                                           | 17/30 [00:42<00:19,  1.49s/it]2026-07-16 08:21:19 - HeartDisease_RiskDiscovery - INFO - RandomForest initialized with resolved params: {'n_estimators': 400, 'max_depth': 10, 'max_features': 'log2', 'min_samples_leaf': 1, 'class_weight': 'balanced', 'random_state': 44, 'n_jobs': -1}
2026-07-16 08:21:19 - HeartDisease_RiskDiscovery - INFO - Training RandomForest on 44794 samples
2026-07-16 08:21:20 - HeartDisease_RiskDiscovery - INFO - RandomForest training completed
[I 2026-07-16 08:21:20,455] Trial 17 finished with value: 0.7912152577416269 and parameters: {'use_max_depth': True, 'max_depth': 10, 'use_max_features_cat': True, 'max_features': 'log2', 'n_estimators': 400, 'min_samples_leaf': 1}. Best is trial 2 with value: 0.7913818299960927.
Best trial: 2. Best value: 0.791382:  60%|█████████████████████████████████████████████████████████████████████████████████▌                                                      | 18/30 [00:43<00:16,  1.37s/it]2026-07-16 08:21:20 - HeartDisease_RiskDiscovery - INFO - RandomForest initialized with resolved params: {'n_estimators': 650, 'max_depth': None, 'max_features': 0.7937831590489541, 'min_samples_leaf': 2, 'class_weight': 'balanced', 'random_state': 44, 'n_jobs': -1}
2026-07-16 08:21:20 - HeartDisease_RiskDiscovery - INFO - Training RandomForest on 44794 samples
2026-07-16 08:21:28 - HeartDisease_RiskDiscovery - INFO - RandomForest training completed
[I 2026-07-16 08:21:28,780] Trial 18 finished with value: 0.7663050139447412 and parameters: {'use_max_depth': False, 'use_max_features_cat': False, 'max_features_float': 0.7937831590489541, 'n_estimators': 650, 'min_samples_leaf': 2}. Best is trial 2 with value: 0.7913818299960927.
Best trial: 2. Best value: 0.791382:  63%|██████████████████████████████████████████████████████████████████████████████████████▏                                                 | 19/30 [00:52<00:38,  3.46s/it]2026-07-16 08:21:28 - HeartDisease_RiskDiscovery - INFO - RandomForest initialized with resolved params: {'n_estimators': 900, 'max_depth': 17, 'max_features': 'log2', 'min_samples_leaf': 1, 'class_weight': 'balanced', 'random_state': 44, 'n_jobs': -1}
2026-07-16 08:21:28 - HeartDisease_RiskDiscovery - INFO - Training RandomForest on 44794 samples
2026-07-16 08:21:31 - HeartDisease_RiskDiscovery - INFO - RandomForest training completed
[I 2026-07-16 08:21:32,114] Trial 19 finished with value: 0.7845135436894132 and parameters: {'use_max_depth': True, 'max_depth': 17, 'use_max_features_cat': True, 'max_features': 'log2', 'n_estimators': 900, 'min_samples_leaf': 1}. Best is trial 2 with value: 0.7913818299960927.
Best trial: 2. Best value: 0.791382:  67%|██████████████████████████████████████████████████████████████████████████████████████████▋                                             | 20/30 [00:55<00:34,  3.42s/it]2026-07-16 08:21:32 - HeartDisease_RiskDiscovery - INFO - RandomForest initialized with resolved params: {'n_estimators': 500, 'max_depth': 9, 'max_features': 'log2', 'min_samples_leaf': 13, 'class_weight': 'balanced', 'random_state': 44, 'n_jobs': -1}
2026-07-16 08:21:32 - HeartDisease_RiskDiscovery - INFO - Training RandomForest on 44794 samples
2026-07-16 08:21:33 - HeartDisease_RiskDiscovery - INFO - RandomForest training completed
[I 2026-07-16 08:21:33,368] Trial 20 finished with value: 0.7909379457294516 and parameters: {'use_max_depth': True, 'max_depth': 9, 'use_max_features_cat': True, 'max_features': 'log2', 'n_estimators': 500, 'min_samples_leaf': 13}. Best is trial 2 with value: 0.7913818299960927.
Best trial: 2. Best value: 0.791382:  70%|███████████████████████████████████████████████████████████████████████████████████████████████▏                                        | 21/30 [00:56<00:24,  2.77s/it]2026-07-16 08:21:33 - HeartDisease_RiskDiscovery - INFO - RandomForest initialized with resolved params: {'n_estimators': 350, 'max_depth': 10, 'max_features': 'log2', 'min_samples_leaf': 4, 'class_weight': 'balanced', 'random_state': 44, 'n_jobs': -1}
2026-07-16 08:21:33 - HeartDisease_RiskDiscovery - INFO - Training RandomForest on 44794 samples
2026-07-16 08:21:34 - HeartDisease_RiskDiscovery - INFO - RandomForest training completed
[I 2026-07-16 08:21:34,290] Trial 21 finished with value: 0.7911853160042339 and parameters: {'use_max_depth': True, 'max_depth': 10, 'use_max_features_cat': True, 'max_features': 'log2', 'n_estimators': 350, 'min_samples_leaf': 4}. Best is trial 2 with value: 0.7913818299960927.
Best trial: 2. Best value: 0.791382:  73%|███████████████████████████████████████████████████████████████████████████████████████████████████▋                                    | 22/30 [00:57<00:17,  2.22s/it]2026-07-16 08:21:34 - HeartDisease_RiskDiscovery - INFO - RandomForest initialized with resolved params: {'n_estimators': 350, 'max_depth': 11, 'max_features': 'log2', 'min_samples_leaf': 3, 'class_weight': 'balanced', 'random_state': 44, 'n_jobs': -1}
2026-07-16 08:21:34 - HeartDisease_RiskDiscovery - INFO - Training RandomForest on 44794 samples
2026-07-16 08:21:35 - HeartDisease_RiskDiscovery - INFO - RandomForest training completed
[I 2026-07-16 08:21:35,279] Trial 22 finished with value: 0.7906378558577251 and parameters: {'use_max_depth': True, 'max_depth': 11, 'use_max_features_cat': True, 'max_features': 'log2', 'n_estimators': 350, 'min_samples_leaf': 3}. Best is trial 2 with value: 0.7913818299960927.
Best trial: 2. Best value: 0.791382:  77%|████████████████████████████████████████████████████████████████████████████████████████████████████████▎                               | 23/30 [00:58<00:12,  1.85s/it]2026-07-16 08:21:35 - HeartDisease_RiskDiscovery - INFO - RandomForest initialized with resolved params: {'n_estimators': 550, 'max_depth': 15, 'max_features': 'log2', 'min_samples_leaf': 1, 'class_weight': 'balanced', 'random_state': 44, 'n_jobs': -1}
2026-07-16 08:21:35 - HeartDisease_RiskDiscovery - INFO - Training RandomForest on 44794 samples
2026-07-16 08:21:37 - HeartDisease_RiskDiscovery - INFO - RandomForest training completed
[I 2026-07-16 08:21:37,520] Trial 23 finished with value: 0.7860597285259767 and parameters: {'use_max_depth': True, 'max_depth': 15, 'use_max_features_cat': True, 'max_features': 'log2', 'n_estimators': 550, 'min_samples_leaf': 1}. Best is trial 2 with value: 0.7913818299960927.
Best trial: 2. Best value: 0.791382:  80%|████████████████████████████████████████████████████████████████████████████████████████████████████████████▊                           | 24/30 [01:01<00:11,  1.97s/it]2026-07-16 08:21:37 - HeartDisease_RiskDiscovery - INFO - RandomForest initialized with resolved params: {'n_estimators': 750, 'max_depth': 10, 'max_features': 'log2', 'min_samples_leaf': 3, 'class_weight': 'balanced', 'random_state': 44, 'n_jobs': -1}
2026-07-16 08:21:37 - HeartDisease_RiskDiscovery - INFO - Training RandomForest on 44794 samples
2026-07-16 08:21:39 - HeartDisease_RiskDiscovery - INFO - RandomForest training completed
[I 2026-07-16 08:21:39,438] Trial 24 finished with value: 0.7912398640182742 and parameters: {'use_max_depth': True, 'max_depth': 10, 'use_max_features_cat': True, 'max_features': 'log2', 'n_estimators': 750, 'min_samples_leaf': 3}. Best is trial 2 with value: 0.7913818299960927.
Best trial: 2. Best value: 0.791382:  83%|█████████████████████████████████████████████████████████████████████████████████████████████████████████████████▎                      | 25/30 [01:02<00:09,  1.95s/it]2026-07-16 08:21:39 - HeartDisease_RiskDiscovery - INFO - RandomForest initialized with resolved params: {'n_estimators': 750, 'max_depth': 7, 'max_features': 'log2', 'min_samples_leaf': 10, 'class_weight': 'balanced', 'random_state': 44, 'n_jobs': -1}
2026-07-16 08:21:39 - HeartDisease_RiskDiscovery - INFO - Training RandomForest on 44794 samples
2026-07-16 08:21:40 - HeartDisease_RiskDiscovery - INFO - RandomForest training completed
[I 2026-07-16 08:21:41,108] Trial 25 finished with value: 0.7897530771397421 and parameters: {'use_max_depth': True, 'max_depth': 7, 'use_max_features_cat': True, 'max_features': 'log2', 'n_estimators': 750, 'min_samples_leaf': 10}. Best is trial 2 with value: 0.7913818299960927.
Best trial: 2. Best value: 0.791382:  87%|█████████████████████████████████████████████████████████████████████████████████████████████████████████████████████▊                  | 26/30 [01:04<00:07,  1.87s/it]2026-07-16 08:21:41 - HeartDisease_RiskDiscovery - INFO - RandomForest initialized with resolved params: {'n_estimators': 1100, 'max_depth': None, 'max_features': 0.5862395311463924, 'min_samples_leaf': 7, 'class_weight': 'balanced', 'random_state': 44, 'n_jobs': -1}
2026-07-16 08:21:41 - HeartDisease_RiskDiscovery - INFO - Training RandomForest on 44794 samples
2026-07-16 08:21:49 - HeartDisease_RiskDiscovery - INFO - RandomForest training completed
[I 2026-07-16 08:21:49,749] Trial 26 finished with value: 0.7837733009986421 and parameters: {'use_max_depth': False, 'use_max_features_cat': False, 'max_features_float': 0.5862395311463924, 'n_estimators': 1100, 'min_samples_leaf': 7}. Best is trial 2 with value: 0.7913818299960927.
Best trial: 2. Best value: 0.791382:  90%|██████████████████████████████████████████████████████████████████████████████████████████████████████████████████████████▍             | 27/30 [01:13<00:11,  3.90s/it]2026-07-16 08:21:49 - HeartDisease_RiskDiscovery - INFO - RandomForest initialized with resolved params: {'n_estimators': 750, 'max_depth': 14, 'max_features': 'log2', 'min_samples_leaf': 3, 'class_weight': 'balanced', 'random_state': 44, 'n_jobs': -1}
2026-07-16 08:21:49 - HeartDisease_RiskDiscovery - INFO - Training RandomForest on 44794 samples
2026-07-16 08:21:51 - HeartDisease_RiskDiscovery - INFO - RandomForest training completed
[I 2026-07-16 08:21:52,064] Trial 27 finished with value: 0.7893622890436908 and parameters: {'use_max_depth': True, 'max_depth': 14, 'use_max_features_cat': True, 'max_features': 'log2', 'n_estimators': 750, 'min_samples_leaf': 3}. Best is trial 2 with value: 0.7913818299960927.
Best trial: 2. Best value: 0.791382:  93%|██████████████████████████████████████████████████████████████████████████████████████████████████████████████████████████████▉         | 28/30 [01:15<00:06,  3.42s/it]2026-07-16 08:21:52 - HeartDisease_RiskDiscovery - INFO - RandomForest initialized with resolved params: {'n_estimators': 1000, 'max_depth': 16, 'max_features': 'log2', 'min_samples_leaf': 1, 'class_weight': 'balanced', 'random_state': 44, 'n_jobs': -1}
2026-07-16 08:21:52 - HeartDisease_RiskDiscovery - INFO - Training RandomForest on 44794 samples
2026-07-16 08:21:55 - HeartDisease_RiskDiscovery - INFO - RandomForest training completed
[I 2026-07-16 08:21:55,667] Trial 28 finished with value: 0.7856064398609891 and parameters: {'use_max_depth': True, 'max_depth': 16, 'use_max_features_cat': True, 'max_features': 'log2', 'n_estimators': 1000, 'min_samples_leaf': 1}. Best is trial 2 with value: 0.7913818299960927.
Best trial: 2. Best value: 0.791382:  97%|███████████████████████████████████████████████████████████████████████████████████████████████████████████████████████████████████▍    | 29/30 [01:19<00:03,  3.48s/it]2026-07-16 08:21:55 - HeartDisease_RiskDiscovery - INFO - RandomForest initialized with resolved params: {'n_estimators': 700, 'max_depth': 20, 'max_features': 'log2', 'min_samples_leaf': 8, 'class_weight': 'balanced', 'random_state': 44, 'n_jobs': -1}
2026-07-16 08:21:55 - HeartDisease_RiskDiscovery - INFO - Training RandomForest on 44794 samples
2026-07-16 08:21:58 - HeartDisease_RiskDiscovery - INFO - RandomForest training completed
