[I 2026-07-16 08:17:12,407] Trial 0 finished with value: 0.7788403645931496 and parameters: {'use_max_depth': False, 'use_max_features_cat': True, 'max_features': 'sqrt', 'n_estimators': 250, 'min_samples_leaf': 13}. Best is trial 0 with value: 0.7788403645931496.
Best trial: 0. Best value: 0.77884:   3%|████▎                                                                                                                              | 1/30 [00:00<00:25,  1.15it/s]2026-07-16 08:17:12 - HeartDisease_RiskDiscovery - INFO - RandomForest initialized with resolved params: {'n_estimators': 450, 'max_depth': None, 'max_features': 0.8659541126403374, 'min_samples_leaf': 3, 'class_weight': 'balanced', 'random_state': 42, 'n_jobs': -1}
2026-07-16 08:17:12 - HeartDisease_RiskDiscovery - INFO - Training RandomForest on 44794 samples
2026-07-16 08:17:18 - HeartDisease_RiskDiscovery - INFO - RandomForest training completed
[I 2026-07-16 08:17:18,491] Trial 1 finished with value: 0.7601030159294897 and parameters: {'use_max_depth': False, 'use_max_features_cat': False, 'max_features_float': 0.8659541126403374, 'n_estimators': 450, 'min_samples_leaf': 3}. Best is trial 0 with value: 0.7788403645931496.
Best trial: 0. Best value: 0.77884:   7%|████████▋                                                                                                                          | 2/30 [00:06<01:50,  3.94s/it]2026-07-16 08:17:18 - HeartDisease_RiskDiscovery - INFO - RandomForest initialized with resolved params: {'n_estimators': 350, 'max_depth': None, 'max_features': 'log2', 'min_samples_leaf': 5, 'class_weight': 'balanced', 'random_state': 42, 'n_jobs': -1}
2026-07-16 08:17:18 - HeartDisease_RiskDiscovery - INFO - Training RandomForest on 44794 samples
2026-07-16 08:17:19 - HeartDisease_RiskDiscovery - INFO - RandomForest training completed
[I 2026-07-16 08:17:19,822] Trial 2 finished with value: 0.7759821513036514 and parameters: {'use_max_depth': False, 'use_max_features_cat': True, 'max_features': 'log2', 'n_estimators': 350, 'min_samples_leaf': 5}. Best is trial 0 with value: 0.7788403645931496.
Best trial: 0. Best value: 0.77884:  10%|█████████████                                                                                                                      | 3/30 [00:08<01:14,  2.75s/it]2026-07-16 08:17:19 - HeartDisease_RiskDiscovery - INFO - RandomForest initialized with resolved params: {'n_estimators': 250, 'max_depth': None, 'max_features': 'log2', 'min_samples_leaf': 10, 'class_weight': 'balanced', 'random_state': 42, 'n_jobs': -1}
2026-07-16 08:17:19 - HeartDisease_RiskDiscovery - INFO - Training RandomForest on 44794 samples
2026-07-16 08:17:20 - HeartDisease_RiskDiscovery - INFO - RandomForest training completed
[I 2026-07-16 08:17:20,696] Trial 3 finished with value: 0.7791085853864331 and parameters: {'use_max_depth': False, 'use_max_features_cat': True, 'max_features': 'log2', 'n_estimators': 250, 'min_samples_leaf': 10}. Best is trial 3 with value: 0.7791085853864331.
Best trial: 3. Best value: 0.779109:  13%|█████████████████▎                                                                                                                | 4/30 [00:09<00:52,  2.01s/it]2026-07-16 08:17:20 - HeartDisease_RiskDiscovery - INFO - RandomForest initialized with resolved params: {'n_estimators': 1100, 'max_depth': 29, 'max_features': 'sqrt', 'min_samples_leaf': 7, 'class_weight': 'balanced', 'random_state': 42, 'n_jobs': -1}
2026-07-16 08:17:20 - HeartDisease_RiskDiscovery - INFO - Training RandomForest on 44794 samples
2026-07-16 08:17:24 - HeartDisease_RiskDiscovery - INFO - RandomForest training completed
[I 2026-07-16 08:17:24,533] Trial 4 finished with value: 0.7777230321097892 and parameters: {'use_max_depth': True, 'max_depth': 29, 'use_max_features_cat': True, 'max_features': 'sqrt', 'n_estimators': 1100, 'min_samples_leaf': 7}. Best is trial 3 with value: 0.7791085853864331.
Best trial: 3. Best value: 0.779109:  17%|█████████████████████▋                                                                                                            | 5/30 [00:12<01:06,  2.67s/it]2026-07-16 08:17:24 - HeartDisease_RiskDiscovery - INFO - RandomForest initialized with resolved params: {'n_estimators': 1050, 'max_depth': None, 'max_features': 0.40702398528001354, 'min_samples_leaf': 5, 'class_weight': 'balanced', 'random_state': 42, 'n_jobs': -1}
2026-07-16 08:17:24 - HeartDisease_RiskDiscovery - INFO - Training RandomForest on 44794 samples
2026-07-16 08:17:30 - HeartDisease_RiskDiscovery - INFO - RandomForest training completed
[I 2026-07-16 08:17:30,840] Trial 5 finished with value: 0.7726108477712514 and parameters: {'use_max_depth': False, 'use_max_features_cat': False, 'max_features_float': 0.40702398528001354, 'n_estimators': 1050, 'min_samples_leaf': 5}. Best is trial 3 with value: 0.7791085853864331.
Best trial: 3. Best value: 0.779109:  20%|██████████████████████████                                                                                                        | 6/30 [00:19<01:33,  3.90s/it]2026-07-16 08:17:30 - HeartDisease_RiskDiscovery - INFO - RandomForest initialized with resolved params: {'n_estimators': 1450, 'max_depth': None, 'max_features': 0.8201062586888916, 'min_samples_leaf': 14, 'class_weight': 'balanced', 'random_state': 42, 'n_jobs': -1}
2026-07-16 08:17:30 - HeartDisease_RiskDiscovery - INFO - Training RandomForest on 44794 samples
2026-07-16 08:17:45 - HeartDisease_RiskDiscovery - INFO - RandomForest training completed
[I 2026-07-16 08:17:45,350] Trial 6 finished with value: 0.774696885109385 and parameters: {'use_max_depth': False, 'use_max_features_cat': False, 'max_features_float': 0.8201062586888916, 'n_estimators': 1450, 'min_samples_leaf': 14}. Best is trial 3 with value: 0.7791085853864331.
Best trial: 3. Best value: 0.779109:  23%|██████████████████████████████▎                                                                                                   | 7/30 [00:33<02:49,  7.37s/it]2026-07-16 08:17:45 - HeartDisease_RiskDiscovery - INFO - RandomForest initialized with resolved params: {'n_estimators': 600, 'max_depth': None, 'max_features': 0.23618183112843047, 'min_samples_leaf': 6, 'class_weight': 'balanced', 'random_state': 42, 'n_jobs': -1}
2026-07-16 08:17:45 - HeartDisease_RiskDiscovery - INFO - Training RandomForest on 44794 samples
2026-07-16 08:17:47 - HeartDisease_RiskDiscovery - INFO - RandomForest training completed
[I 2026-07-16 08:17:47,797] Trial 7 finished with value: 0.7761589435551066 and parameters: {'use_max_depth': False, 'use_max_features_cat': False, 'max_features_float': 0.23618183112843047, 'n_estimators': 600, 'min_samples_leaf': 6}. Best is trial 3 with value: 0.7791085853864331.
Best trial: 3. Best value: 0.779109:  27%|██████████████████████████████████▋                                                                                               | 8/30 [00:36<02:07,  5.80s/it]2026-07-16 08:17:47 - HeartDisease_RiskDiscovery - INFO - RandomForest initialized with resolved params: {'n_estimators': 1250, 'max_depth': None, 'max_features': 'sqrt', 'min_samples_leaf': 2, 'class_weight': 'balanced', 'random_state': 42, 'n_jobs': -1}
2026-07-16 08:17:47 - HeartDisease_RiskDiscovery - INFO - Training RandomForest on 44794 samples
2026-07-16 08:17:52 - HeartDisease_RiskDiscovery - INFO - RandomForest training completed
[I 2026-07-16 08:17:53,069] Trial 8 finished with value: 0.7683748127719062 and parameters: {'use_max_depth': False, 'use_max_features_cat': True, 'max_features': 'sqrt', 'n_estimators': 1250, 'min_samples_leaf': 2}. Best is trial 3 with value: 0.7791085853864331.
Best trial: 3. Best value: 0.779109:  30%|███████████████████████████████████████                                                                                           | 9/30 [00:41<01:58,  5.64s/it]2026-07-16 08:17:53 - HeartDisease_RiskDiscovery - INFO - RandomForest initialized with resolved params: {'n_estimators': 1150, 'max_depth': 10, 'max_features': 0.7654858750780937, 'min_samples_leaf': 12, 'class_weight': 'balanced', 'random_state': 42, 'n_jobs': -1}
2026-07-16 08:17:53 - HeartDisease_RiskDiscovery - INFO - Training RandomForest on 44794 samples
2026-07-16 08:18:00 - HeartDisease_RiskDiscovery - INFO - RandomForest training completed
[I 2026-07-16 08:18:00,614] Trial 9 finished with value: 0.7781585129314639 and parameters: {'use_max_depth': True, 'max_depth': 10, 'use_max_features_cat': False, 'max_features_float': 0.7654858750780937, 'n_estimators': 1150, 'min_samples_leaf': 12}. Best is trial 3 with value: 0.7791085853864331.
Best trial: 3. Best value: 0.779109:  33%|███████████████████████████████████████████                                                                                      | 10/30 [00:49<02:04,  6.23s/it]2026-07-16 08:18:00 - HeartDisease_RiskDiscovery - INFO - RandomForest initialized with resolved params: {'n_estimators': 750, 'max_depth': 6, 'max_features': 'log2', 'min_samples_leaf': 9, 'class_weight': 'balanced', 'random_state': 42, 'n_jobs': -1}
2026-07-16 08:18:00 - HeartDisease_RiskDiscovery - INFO - Training RandomForest on 44794 samples
2026-07-16 08:18:02 - HeartDisease_RiskDiscovery - INFO - RandomForest training completed
[I 2026-07-16 08:18:02,255] Trial 10 finished with value: 0.7780415308869939 and parameters: {'use_max_depth': True, 'max_depth': 6, 'use_max_features_cat': True, 'max_features': 'log2', 'n_estimators': 750, 'min_samples_leaf': 9}. Best is trial 3 with value: 0.7791085853864331.
Best trial: 3. Best value: 0.779109:  37%|███████████████████████████████████████████████▎                                                                                 | 11/30 [00:50<01:31,  4.82s/it]2026-07-16 08:18:02 - HeartDisease_RiskDiscovery - INFO - RandomForest initialized with resolved params: {'n_estimators': 200, 'max_depth': None, 'max_features': 'log2', 'min_samples_leaf': 11, 'class_weight': 'balanced', 'random_state': 42, 'n_jobs': -1}
2026-07-16 08:18:02 - HeartDisease_RiskDiscovery - INFO - Training RandomForest on 44794 samples
2026-07-16 08:18:02 - HeartDisease_RiskDiscovery - INFO - RandomForest training completed
[I 2026-07-16 08:18:02,968] Trial 11 finished with value: 0.7787935593360762 and parameters: {'use_max_depth': False, 'use_max_features_cat': True, 'max_features': 'log2', 'n_estimators': 200, 'min_samples_leaf': 11}. Best is trial 3 with value: 0.7791085853864331.
Best trial: 3. Best value: 0.779109:  40%|███████████████████████████████████████████████████▌                                                                             | 12/30 [00:51<01:04,  3.57s/it]2026-07-16 08:18:02 - HeartDisease_RiskDiscovery - INFO - RandomForest initialized with resolved params: {'n_estimators': 200, 'max_depth': None, 'max_features': 'sqrt', 'min_samples_leaf': 15, 'class_weight': 'balanced', 'random_state': 42, 'n_jobs': -1}
2026-07-16 08:18:02 - HeartDisease_RiskDiscovery - INFO - Training RandomForest on 44794 samples
2026-07-16 08:18:03 - HeartDisease_RiskDiscovery - INFO - RandomForest training completed
[I 2026-07-16 08:18:03,666] Trial 12 finished with value: 0.779490457634769 and parameters: {'use_max_depth': False, 'use_max_features_cat': True, 'max_features': 'sqrt', 'n_estimators': 200, 'min_samples_leaf': 15}. Best is trial 12 with value: 0.779490457634769.
Best trial: 12. Best value: 0.77949:  43%|███████████████████████████████████████████████████████▉                                                                         | 13/30 [00:52<00:45,  2.70s/it]2026-07-16 08:18:03 - HeartDisease_RiskDiscovery - INFO - RandomForest initialized with resolved params: {'n_estimators': 500, 'max_depth': None, 'max_features': 'sqrt', 'min_samples_leaf': 15, 'class_weight': 'balanced', 'random_state': 42, 'n_jobs': -1}
2026-07-16 08:18:03 - HeartDisease_RiskDiscovery - INFO - Training RandomForest on 44794 samples
2026-07-16 08:18:05 - HeartDisease_RiskDiscovery - INFO - RandomForest training completed
[I 2026-07-16 08:18:05,309] Trial 13 finished with value: 0.7791013658714786 and parameters: {'use_max_depth': False, 'use_max_features_cat': True, 'max_features': 'sqrt', 'n_estimators': 500, 'min_samples_leaf': 15}. Best is trial 12 with value: 0.779490457634769.
Best trial: 12. Best value: 0.77949:  47%|████████████████████████████████████████████████████████████▏                                                                    | 14/30 [00:53<00:38,  2.38s/it]2026-07-16 08:18:05 - HeartDisease_RiskDiscovery - INFO - RandomForest initialized with resolved params: {'n_estimators': 750, 'max_depth': 25, 'max_features': 'log2', 'min_samples_leaf': 10, 'class_weight': 'balanced', 'random_state': 42, 'n_jobs': -1}
2026-07-16 08:18:05 - HeartDisease_RiskDiscovery - INFO - Training RandomForest on 44794 samples
2026-07-16 08:18:07 - HeartDisease_RiskDiscovery - INFO - RandomForest training completed
[I 2026-07-16 08:18:07,772] Trial 14 finished with value: 0.7789606881075738 and parameters: {'use_max_depth': True, 'max_depth': 25, 'use_max_features_cat': True, 'max_features': 'log2', 'n_estimators': 750, 'min_samples_leaf': 10}. Best is trial 12 with value: 0.779490457634769.
Best trial: 12. Best value: 0.77949:  50%|████████████████████████████████████████████████████████████████▌                                                                | 15/30 [00:56<00:36,  2.41s/it]2026-07-16 08:18:07 - HeartDisease_RiskDiscovery - INFO - RandomForest initialized with resolved params: {'n_estimators': 200, 'max_depth': None, 'max_features': 'sqrt', 'min_samples_leaf': 15, 'class_weight': 'balanced', 'random_state': 42, 'n_jobs': -1}
2026-07-16 08:18:07 - HeartDisease_RiskDiscovery - INFO - Training RandomForest on 44794 samples
2026-07-16 08:18:08 - HeartDisease_RiskDiscovery - INFO - RandomForest training completed
[I 2026-07-16 08:18:08,446] Trial 15 finished with value: 0.779490457634769 and parameters: {'use_max_depth': False, 'use_max_features_cat': True, 'max_features': 'sqrt', 'n_estimators': 200, 'min_samples_leaf': 15}. Best is trial 12 with value: 0.779490457634769.
Best trial: 12. Best value: 0.77949:  53%|████████████████████████████████████████████████████████████████████▊                                                            | 16/30 [00:56<00:26,  1.88s/it]2026-07-16 08:18:08 - HeartDisease_RiskDiscovery - INFO - RandomForest initialized with resolved params: {'n_estimators': 600, 'max_depth': None, 'max_features': 'sqrt', 'min_samples_leaf': 15, 'class_weight': 'balanced', 'random_state': 42, 'n_jobs': -1}
2026-07-16 08:18:08 - HeartDisease_RiskDiscovery - INFO - Training RandomForest on 44794 samples
2026-07-16 08:18:10 - HeartDisease_RiskDiscovery - INFO - RandomForest training completed
[I 2026-07-16 08:18:10,307] Trial 16 finished with value: 0.7792353399552735 and parameters: {'use_max_depth': False, 'use_max_features_cat': True, 'max_features': 'sqrt', 'n_estimators': 600, 'min_samples_leaf': 15}. Best is trial 12 with value: 0.779490457634769.
Best trial: 12. Best value: 0.77949:  57%|█████████████████████████████████████████████████████████████████████████                                                        | 17/30 [00:58<00:24,  1.88s/it]2026-07-16 08:18:10 - HeartDisease_RiskDiscovery - INFO - RandomForest initialized with resolved params: {'n_estimators': 400, 'max_depth': None, 'max_features': 'sqrt', 'min_samples_leaf': 13, 'class_weight': 'balanced', 'random_state': 42, 'n_jobs': -1}
2026-07-16 08:18:10 - HeartDisease_RiskDiscovery - INFO - Training RandomForest on 44794 samples
2026-07-16 08:18:11 - HeartDisease_RiskDiscovery - INFO - RandomForest training completed
[I 2026-07-16 08:18:11,610] Trial 17 finished with value: 0.778898799070113 and parameters: {'use_max_depth': False, 'use_max_features_cat': True, 'max_features': 'sqrt', 'n_estimators': 400, 'min_samples_leaf': 13}. Best is trial 12 with value: 0.779490457634769.
Best trial: 12. Best value: 0.77949:  60%|█████████████████████████████████████████████████████████████████████████████▍                                                   | 18/30 [01:00<00:20,  1.71s/it]2026-07-16 08:18:11 - HeartDisease_RiskDiscovery - INFO - RandomForest initialized with resolved params: {'n_estimators': 950, 'max_depth': 19, 'max_features': 'sqrt', 'min_samples_leaf': 15, 'class_weight': 'balanced', 'random_state': 42, 'n_jobs': -1}
2026-07-16 08:18:11 - HeartDisease_RiskDiscovery - INFO - Training RandomForest on 44794 samples
2026-07-16 08:18:14 - HeartDisease_RiskDiscovery - INFO - RandomForest training completed
[I 2026-07-16 08:18:14,575] Trial 18 finished with value: 0.7796040663822508 and parameters: {'use_max_depth': True, 'max_depth': 19, 'use_max_features_cat': True, 'max_features': 'sqrt', 'n_estimators': 950, 'min_samples_leaf': 15}. Best is trial 18 with value: 0.7796040663822508.
Best trial: 18. Best value: 0.779604:  63%|█████████████████████████████████████████████████████████████████████████████████                                               | 19/30 [01:03<00:22,  2.08s/it]2026-07-16 08:18:14 - HeartDisease_RiskDiscovery - INFO - RandomForest initialized with resolved params: {'n_estimators': 850, 'max_depth': 17, 'max_features': 'sqrt', 'min_samples_leaf': 12, 'class_weight': 'balanced', 'random_state': 42, 'n_jobs': -1}
2026-07-16 08:18:14 - HeartDisease_RiskDiscovery - INFO - Training RandomForest on 44794 samples
2026-07-16 08:18:17 - HeartDisease_RiskDiscovery - INFO - RandomForest training completed
[I 2026-07-16 08:18:17,283] Trial 19 finished with value: 0.7790669659091201 and parameters: {'use_max_depth': True, 'max_depth': 17, 'use_max_features_cat': True, 'max_features': 'sqrt', 'n_estimators': 850, 'min_samples_leaf': 12}. Best is trial 18 with value: 0.7796040663822508.
Best trial: 18. Best value: 0.779604:  67%|█████████████████████████████████████████████████████████████████████████████████████▎                                          | 20/30 [01:05<00:22,  2.27s/it]2026-07-16 08:18:17 - HeartDisease_RiskDiscovery - INFO - RandomForest initialized with resolved params: {'n_estimators': 950, 'max_depth': 19, 'max_features': 'sqrt', 'min_samples_leaf': 8, 'class_weight': 'balanced', 'random_state': 42, 'n_jobs': -1}
2026-07-16 08:18:17 - HeartDisease_RiskDiscovery - INFO - Training RandomForest on 44794 samples
2026-07-16 08:18:20 - HeartDisease_RiskDiscovery - INFO - RandomForest training completed
[I 2026-07-16 08:18:20,431] Trial 20 finished with value: 0.777759138852768 and parameters: {'use_max_depth': True, 'max_depth': 19, 'use_max_features_cat': True, 'max_features': 'sqrt', 'n_estimators': 950, 'min_samples_leaf': 8}. Best is trial 18 with value: 0.7796040663822508.
Best trial: 18. Best value: 0.779604:  70%|█████████████████████████████████████████████████████████████████████████████████████████▌                                      | 21/30 [01:08<00:22,  2.53s/it]2026-07-16 08:18:20 - HeartDisease_RiskDiscovery - INFO - RandomForest initialized with resolved params: {'n_estimators': 1350, 'max_depth': 18, 'max_features': 'sqrt', 'min_samples_leaf': 15, 'class_weight': 'balanced', 'random_state': 42, 'n_jobs': -1}
2026-07-16 08:18:20 - HeartDisease_RiskDiscovery - INFO - Training RandomForest on 44794 samples
2026-07-16 08:18:24 - HeartDisease_RiskDiscovery - INFO - RandomForest training completed
[I 2026-07-16 08:18:24,908] Trial 21 finished with value: 0.7794889374050902 and parameters: {'use_max_depth': True, 'max_depth': 18, 'use_max_features_cat': True, 'max_features': 'sqrt', 'n_estimators': 1350, 'min_samples_leaf': 15}. Best is trial 18 with value: 0.7796040663822508.
Best trial: 18. Best value: 0.779604:  73%|█████████████████████████████████████████████████████████████████████████████████████████████▊                                  | 22/30 [01:13<00:24,  3.12s/it]2026-07-16 08:18:24 - HeartDisease_RiskDiscovery - INFO - RandomForest initialized with resolved params: {'n_estimators': 600, 'max_depth': 13, 'max_features': 'sqrt', 'min_samples_leaf': 13, 'class_weight': 'balanced', 'random_state': 42, 'n_jobs': -1}
2026-07-16 08:18:24 - HeartDisease_RiskDiscovery - INFO - Training RandomForest on 44794 samples
2026-07-16 08:18:26 - HeartDisease_RiskDiscovery - INFO - RandomForest training completed
[I 2026-07-16 08:18:26,920] Trial 22 finished with value: 0.7790618256028723 and parameters: {'use_max_depth': True, 'max_depth': 13, 'use_max_features_cat': True, 'max_features': 'sqrt', 'n_estimators': 600, 'min_samples_leaf': 13}. Best is trial 18 with value: 0.7796040663822508.
Best trial: 18. Best value: 0.779604:  77%|██████████████████████████████████████████████████████████████████████████████████████████████████▏                             | 23/30 [01:15<00:19,  2.79s/it]2026-07-16 08:18:26 - HeartDisease_RiskDiscovery - INFO - RandomForest initialized with resolved params: {'n_estimators': 900, 'max_depth': 24, 'max_features': 'sqrt', 'min_samples_leaf': 14, 'class_weight': 'balanced', 'random_state': 42, 'n_jobs': -1}
2026-07-16 08:18:26 - HeartDisease_RiskDiscovery - INFO - Training RandomForest on 44794 samples
2026-07-16 08:18:29 - HeartDisease_RiskDiscovery - INFO - RandomForest training completed
