[I 2026-07-16 08:21:58,343] Trial 29 finished with value: 0.7893113976373074 and parameters: {'use_max_depth': True, 'max_depth': 20, 'use_max_features_cat': True, 'max_features': 'log2', 'n_estimators': 700, 'min_samples_leaf': 8}. Best is trial 2 with value: 0.7913818299960927.
Best trial: 2. Best value: 0.791382: 100%|████████████████████████████████████████████████████████████████████████████████████████████████████████████████████████████████████████| 30/30 [01:21<00:00,  2.73s/it]
2026-07-16 08:21:58 - HeartDisease_RiskDiscovery - INFO - RandomForest initialized with resolved params: {'n_estimators': 500, 'max_depth': 11, 'max_features': 'log2', 'min_samples_leaf': 10, 'class_weight': 'balanced', 'random_state': 44, 'n_jobs': -1}
2026-07-16 08:21:58 - HeartDisease_RiskDiscovery - INFO - Training RandomForest on 44794 samples
2026-07-16 08:21:59 - HeartDisease_RiskDiscovery - INFO - RandomForest training completed
2026-07-16 08:22:00 - HeartDisease_RiskDiscovery - INFO - Feature importance saved to artifacts/Model/rf/fold_2/feature_importance.json
2026-07-16 08:22:00 - HeartDisease_RiskDiscovery - INFO - RandomForest saved to artifacts/Model/rf/fold_2/model.joblib
[I 2026-07-16 08:22:00,561] A new study created in memory with name: no-name-7807f4d8-46b5-41ce-ab61-385751a114e5
  0%|                                                                                                                                                                                      | 0/30 [00:00<?, ?it/s]2026-07-16 08:22:00 - HeartDisease_RiskDiscovery - INFO - RandomForest initialized with resolved params: {'n_estimators': 250, 'max_depth': 13, 'max_features': 0.5782463758043883, 'min_samples_leaf': 3, 'class_weight': 'balanced', 'random_state': 45, 'n_jobs': -1}
2026-07-16 08:22:00 - HeartDisease_RiskDiscovery - INFO - Training RandomForest on 44795 samples
2026-07-16 08:22:02 - HeartDisease_RiskDiscovery - INFO - RandomForest training completed
[I 2026-07-16 08:22:02,202] Trial 0 finished with value: 0.7797573818419602 and parameters: {'use_max_depth': True, 'max_depth': 13, 'use_max_features_cat': False, 'max_features_float': 0.5782463758043883, 'n_estimators': 250, 'min_samples_leaf': 3}. Best is trial 0 with value: 0.7797573818419602.
Best trial: 0. Best value: 0.779757:   3%|████▌                                                                                                                                    | 1/30 [00:01<00:47,  1.64s/it]2026-07-16 08:22:02 - HeartDisease_RiskDiscovery - INFO - RandomForest initialized with resolved params: {'n_estimators': 1000, 'max_depth': None, 'max_features': 'sqrt', 'min_samples_leaf': 5, 'class_weight': 'balanced', 'random_state': 45, 'n_jobs': -1}
2026-07-16 08:22:02 - HeartDisease_RiskDiscovery - INFO - Training RandomForest on 44795 samples
2026-07-16 08:22:05 - HeartDisease_RiskDiscovery - INFO - RandomForest training completed
[I 2026-07-16 08:22:05,674] Trial 1 finished with value: 0.7779191871581301 and parameters: {'use_max_depth': False, 'use_max_features_cat': True, 'max_features': 'sqrt', 'n_estimators': 1000, 'min_samples_leaf': 5}. Best is trial 0 with value: 0.7797573818419602.
Best trial: 0. Best value: 0.779757:   7%|█████████▏                                                                                                                               | 2/30 [00:05<01:16,  2.72s/it]2026-07-16 08:22:05 - HeartDisease_RiskDiscovery - INFO - RandomForest initialized with resolved params: {'n_estimators': 500, 'max_depth': 17, 'max_features': 0.2899687166367957, 'min_samples_leaf': 8, 'class_weight': 'balanced', 'random_state': 45, 'n_jobs': -1}
2026-07-16 08:22:05 - HeartDisease_RiskDiscovery - INFO - Training RandomForest on 44795 samples
2026-07-16 08:22:07 - HeartDisease_RiskDiscovery - INFO - RandomForest training completed
[I 2026-07-16 08:22:07,724] Trial 2 finished with value: 0.7793244299979345 and parameters: {'use_max_depth': True, 'max_depth': 17, 'use_max_features_cat': False, 'max_features_float': 0.2899687166367957, 'n_estimators': 500, 'min_samples_leaf': 8}. Best is trial 0 with value: 0.7797573818419602.
Best trial: 0. Best value: 0.779757:  10%|█████████████▋                                                                                                                           | 3/30 [00:07<01:05,  2.41s/it]2026-07-16 08:22:07 - HeartDisease_RiskDiscovery - INFO - RandomForest initialized with resolved params: {'n_estimators': 1150, 'max_depth': None, 'max_features': 'sqrt', 'min_samples_leaf': 2, 'class_weight': 'balanced', 'random_state': 45, 'n_jobs': -1}
2026-07-16 08:22:07 - HeartDisease_RiskDiscovery - INFO - Training RandomForest on 44795 samples
2026-07-16 08:22:12 - HeartDisease_RiskDiscovery - INFO - RandomForest training completed
[I 2026-07-16 08:22:12,472] Trial 3 finished with value: 0.7696594662091505 and parameters: {'use_max_depth': False, 'use_max_features_cat': True, 'max_features': 'sqrt', 'n_estimators': 1150, 'min_samples_leaf': 2}. Best is trial 0 with value: 0.7797573818419602.
Best trial: 0. Best value: 0.779757:  13%|██████████████████▎                                                                                                                      | 4/30 [00:11<01:26,  3.33s/it]2026-07-16 08:22:12 - HeartDisease_RiskDiscovery - INFO - RandomForest initialized with resolved params: {'n_estimators': 500, 'max_depth': 26, 'max_features': 0.6459461621456606, 'min_samples_leaf': 2, 'class_weight': 'balanced', 'random_state': 45, 'n_jobs': -1}
2026-07-16 08:22:12 - HeartDisease_RiskDiscovery - INFO - Training RandomForest on 44795 samples
2026-07-16 08:22:17 - HeartDisease_RiskDiscovery - INFO - RandomForest training completed
[I 2026-07-16 08:22:17,741] Trial 4 finished with value: 0.7622484685806729 and parameters: {'use_max_depth': True, 'max_depth': 26, 'use_max_features_cat': False, 'max_features_float': 0.6459461621456606, 'n_estimators': 500, 'min_samples_leaf': 2}. Best is trial 0 with value: 0.7797573818419602.
Best trial: 0. Best value: 0.779757:  17%|██████████████████████▊                                                                                                                  | 5/30 [00:17<01:40,  4.03s/it]2026-07-16 08:22:17 - HeartDisease_RiskDiscovery - INFO - RandomForest initialized with resolved params: {'n_estimators': 350, 'max_depth': 26, 'max_features': 'sqrt', 'min_samples_leaf': 13, 'class_weight': 'balanced', 'random_state': 45, 'n_jobs': -1}
2026-07-16 08:22:17 - HeartDisease_RiskDiscovery - INFO - Training RandomForest on 44795 samples
2026-07-16 08:22:18 - HeartDisease_RiskDiscovery - INFO - RandomForest training completed
[I 2026-07-16 08:22:18,855] Trial 5 finished with value: 0.7803377267570035 and parameters: {'use_max_depth': True, 'max_depth': 26, 'use_max_features_cat': True, 'max_features': 'sqrt', 'n_estimators': 350, 'min_samples_leaf': 13}. Best is trial 5 with value: 0.7803377267570035.
Best trial: 5. Best value: 0.780338:  20%|███████████████████████████▍                                                                                                             | 6/30 [00:18<01:12,  3.04s/it]2026-07-16 08:22:18 - HeartDisease_RiskDiscovery - INFO - RandomForest initialized with resolved params: {'n_estimators': 500, 'max_depth': None, 'max_features': 0.733065976978774, 'min_samples_leaf': 4, 'class_weight': 'balanced', 'random_state': 45, 'n_jobs': -1}
2026-07-16 08:22:18 - HeartDisease_RiskDiscovery - INFO - Training RandomForest on 44795 samples
2026-07-16 08:22:24 - HeartDisease_RiskDiscovery - INFO - RandomForest training completed
[I 2026-07-16 08:22:24,778] Trial 6 finished with value: 0.7677809675207137 and parameters: {'use_max_depth': False, 'use_max_features_cat': False, 'max_features_float': 0.733065976978774, 'n_estimators': 500, 'min_samples_leaf': 4}. Best is trial 5 with value: 0.7803377267570035.
Best trial: 5. Best value: 0.780338:  23%|███████████████████████████████▉                                                                                                         | 7/30 [00:24<01:31,  3.98s/it]2026-07-16 08:22:24 - HeartDisease_RiskDiscovery - INFO - RandomForest initialized with resolved params: {'n_estimators': 600, 'max_depth': 16, 'max_features': 0.36567330261968123, 'min_samples_leaf': 10, 'class_weight': 'balanced', 'random_state': 45, 'n_jobs': -1}
2026-07-16 08:22:24 - HeartDisease_RiskDiscovery - INFO - Training RandomForest on 44795 samples
2026-07-16 08:22:27 - HeartDisease_RiskDiscovery - INFO - RandomForest training completed
[I 2026-07-16 08:22:27,718] Trial 7 finished with value: 0.7796518483962158 and parameters: {'use_max_depth': True, 'max_depth': 16, 'use_max_features_cat': False, 'max_features_float': 0.36567330261968123, 'n_estimators': 600, 'min_samples_leaf': 10}. Best is trial 5 with value: 0.7803377267570035.
Best trial: 5. Best value: 0.780338:  27%|████████████████████████████████████▌                                                                                                    | 8/30 [00:27<01:20,  3.65s/it]2026-07-16 08:22:27 - HeartDisease_RiskDiscovery - INFO - RandomForest initialized with resolved params: {'n_estimators': 1500, 'max_depth': 10, 'max_features': 'log2', 'min_samples_leaf': 14, 'class_weight': 'balanced', 'random_state': 45, 'n_jobs': -1}
2026-07-16 08:22:27 - HeartDisease_RiskDiscovery - INFO - Training RandomForest on 44795 samples
2026-07-16 08:22:31 - HeartDisease_RiskDiscovery - INFO - RandomForest training completed
[I 2026-07-16 08:22:31,423] Trial 8 finished with value: 0.7814220274519619 and parameters: {'use_max_depth': True, 'max_depth': 10, 'use_max_features_cat': True, 'max_features': 'log2', 'n_estimators': 1500, 'min_samples_leaf': 14}. Best is trial 8 with value: 0.7814220274519619.
Best trial: 8. Best value: 0.781422:  30%|█████████████████████████████████████████                                                                                                | 9/30 [00:30<01:17,  3.67s/it]2026-07-16 08:22:31 - HeartDisease_RiskDiscovery - INFO - RandomForest initialized with resolved params: {'n_estimators': 250, 'max_depth': None, 'max_features': 0.7864956004618102, 'min_samples_leaf': 3, 'class_weight': 'balanced', 'random_state': 45, 'n_jobs': -1}
2026-07-16 08:22:31 - HeartDisease_RiskDiscovery - INFO - Training RandomForest on 44795 samples
2026-07-16 08:22:34 - HeartDisease_RiskDiscovery - INFO - RandomForest training completed
[I 2026-07-16 08:22:34,499] Trial 9 finished with value: 0.7636372001435847 and parameters: {'use_max_depth': False, 'use_max_features_cat': False, 'max_features_float': 0.7864956004618102, 'n_estimators': 250, 'min_samples_leaf': 3}. Best is trial 8 with value: 0.7814220274519619.
Best trial: 8. Best value: 0.781422:  33%|█████████████████████████████████████████████▎                                                                                          | 10/30 [00:33<01:09,  3.48s/it]2026-07-16 08:22:34 - HeartDisease_RiskDiscovery - INFO - RandomForest initialized with resolved params: {'n_estimators': 1500, 'max_depth': 6, 'max_features': 'log2', 'min_samples_leaf': 15, 'class_weight': 'balanced', 'random_state': 45, 'n_jobs': -1}
2026-07-16 08:22:34 - HeartDisease_RiskDiscovery - INFO - Training RandomForest on 44795 samples
2026-07-16 08:22:37 - HeartDisease_RiskDiscovery - INFO - RandomForest training completed
[I 2026-07-16 08:22:37,562] Trial 10 finished with value: 0.7800419254402571 and parameters: {'use_max_depth': True, 'max_depth': 6, 'use_max_features_cat': True, 'max_features': 'log2', 'n_estimators': 1500, 'min_samples_leaf': 15}. Best is trial 8 with value: 0.7814220274519619.
Best trial: 8. Best value: 0.781422:  37%|█████████████████████████████████████████████████▊                                                                                      | 11/30 [00:37<01:03,  3.36s/it]2026-07-16 08:22:37 - HeartDisease_RiskDiscovery - INFO - RandomForest initialized with resolved params: {'n_estimators': 1450, 'max_depth': 30, 'max_features': 'log2', 'min_samples_leaf': 15, 'class_weight': 'balanced', 'random_state': 45, 'n_jobs': -1}
2026-07-16 08:22:37 - HeartDisease_RiskDiscovery - INFO - Training RandomForest on 44795 samples
2026-07-16 08:22:41 - HeartDisease_RiskDiscovery - INFO - RandomForest training completed
[I 2026-07-16 08:22:41,907] Trial 11 finished with value: 0.7806114086122589 and parameters: {'use_max_depth': True, 'max_depth': 30, 'use_max_features_cat': True, 'max_features': 'log2', 'n_estimators': 1450, 'min_samples_leaf': 15}. Best is trial 8 with value: 0.7814220274519619.
Best trial: 8. Best value: 0.781422:  40%|██████████████████████████████████████████████████████▍                                                                                 | 12/30 [00:41<01:05,  3.66s/it]2026-07-16 08:22:41 - HeartDisease_RiskDiscovery - INFO - RandomForest initialized with resolved params: {'n_estimators': 1450, 'max_depth': 8, 'max_features': 'log2', 'min_samples_leaf': 15, 'class_weight': 'balanced', 'random_state': 45, 'n_jobs': -1}
2026-07-16 08:22:41 - HeartDisease_RiskDiscovery - INFO - Training RandomForest on 44795 samples
2026-07-16 08:22:45 - HeartDisease_RiskDiscovery - INFO - RandomForest training completed
[I 2026-07-16 08:22:45,546] Trial 12 finished with value: 0.7815437872422044 and parameters: {'use_max_depth': True, 'max_depth': 8, 'use_max_features_cat': True, 'max_features': 'log2', 'n_estimators': 1450, 'min_samples_leaf': 15}. Best is trial 12 with value: 0.7815437872422044.
Best trial: 12. Best value: 0.781544:  43%|██████████████████████████████████████████████████████████▌                                                                            | 13/30 [00:44<01:02,  3.65s/it]2026-07-16 08:22:45 - HeartDisease_RiskDiscovery - INFO - RandomForest initialized with resolved params: {'n_estimators': 1250, 'max_depth': 7, 'max_features': 'log2', 'min_samples_leaf': 12, 'class_weight': 'balanced', 'random_state': 45, 'n_jobs': -1}
2026-07-16 08:22:45 - HeartDisease_RiskDiscovery - INFO - Training RandomForest on 44795 samples
2026-07-16 08:22:48 - HeartDisease_RiskDiscovery - INFO - RandomForest training completed
[I 2026-07-16 08:22:48,230] Trial 13 finished with value: 0.781228702431023 and parameters: {'use_max_depth': True, 'max_depth': 7, 'use_max_features_cat': True, 'max_features': 'log2', 'n_estimators': 1250, 'min_samples_leaf': 12}. Best is trial 12 with value: 0.7815437872422044.
Best trial: 12. Best value: 0.781544:  47%|███████████████████████████████████████████████████████████████                                                                        | 14/30 [00:47<00:53,  3.36s/it]2026-07-16 08:22:48 - HeartDisease_RiskDiscovery - INFO - RandomForest initialized with resolved params: {'n_estimators': 1300, 'max_depth': 11, 'max_features': 'log2', 'min_samples_leaf': 12, 'class_weight': 'balanced', 'random_state': 45, 'n_jobs': -1}
2026-07-16 08:22:48 - HeartDisease_RiskDiscovery - INFO - Training RandomForest on 44795 samples
2026-07-16 08:22:51 - HeartDisease_RiskDiscovery - INFO - RandomForest training completed
[I 2026-07-16 08:22:51,646] Trial 14 finished with value: 0.781439585657212 and parameters: {'use_max_depth': True, 'max_depth': 11, 'use_max_features_cat': True, 'max_features': 'log2', 'n_estimators': 1300, 'min_samples_leaf': 12}. Best is trial 12 with value: 0.7815437872422044.
Best trial: 12. Best value: 0.781544:  50%|███████████████████████████████████████████████████████████████████▌                                                                   | 15/30 [00:51<00:50,  3.38s/it]2026-07-16 08:22:51 - HeartDisease_RiskDiscovery - INFO - RandomForest initialized with resolved params: {'n_estimators': 1300, 'max_depth': 10, 'max_features': 'log2', 'min_samples_leaf': 11, 'class_weight': 'balanced', 'random_state': 45, 'n_jobs': -1}
2026-07-16 08:22:51 - HeartDisease_RiskDiscovery - INFO - Training RandomForest on 44795 samples
2026-07-16 08:22:54 - HeartDisease_RiskDiscovery - INFO - RandomForest training completed
[I 2026-07-16 08:22:54,915] Trial 15 finished with value: 0.7816212994353017 and parameters: {'use_max_depth': True, 'max_depth': 10, 'use_max_features_cat': True, 'max_features': 'log2', 'n_estimators': 1300, 'min_samples_leaf': 11}. Best is trial 15 with value: 0.7816212994353017.
Best trial: 15. Best value: 0.781621:  53%|████████████████████████████████████████████████████████████████████████                                                               | 16/30 [00:54<00:46,  3.34s/it]2026-07-16 08:22:54 - HeartDisease_RiskDiscovery - INFO - RandomForest initialized with resolved params: {'n_estimators': 800, 'max_depth': 21, 'max_features': 'log2', 'min_samples_leaf': 9, 'class_weight': 'balanced', 'random_state': 45, 'n_jobs': -1}
2026-07-16 08:22:54 - HeartDisease_RiskDiscovery - INFO - Training RandomForest on 44795 samples
2026-07-16 08:22:57 - HeartDisease_RiskDiscovery - INFO - RandomForest training completed
[I 2026-07-16 08:22:57,475] Trial 16 finished with value: 0.7798600689273164 and parameters: {'use_max_depth': True, 'max_depth': 21, 'use_max_features_cat': True, 'max_features': 'log2', 'n_estimators': 800, 'min_samples_leaf': 9}. Best is trial 15 with value: 0.7816212994353017.
Best trial: 15. Best value: 0.781621:  57%|████████████████████████████████████████████████████████████████████████████▌                                                          | 17/30 [00:56<00:40,  3.11s/it]2026-07-16 08:22:57 - HeartDisease_RiskDiscovery - INFO - RandomForest initialized with resolved params: {'n_estimators': 1000, 'max_depth': 10, 'max_features': 'log2', 'min_samples_leaf': 7, 'class_weight': 'balanced', 'random_state': 45, 'n_jobs': -1}
2026-07-16 08:22:57 - HeartDisease_RiskDiscovery - INFO - Training RandomForest on 44795 samples
2026-07-16 08:22:59 - HeartDisease_RiskDiscovery - INFO - RandomForest training completed
[I 2026-07-16 08:23:00,042] Trial 17 finished with value: 0.7815593895106578 and parameters: {'use_max_depth': True, 'max_depth': 10, 'use_max_features_cat': True, 'max_features': 'log2', 'n_estimators': 1000, 'min_samples_leaf': 7}. Best is trial 15 with value: 0.7816212994353017.
Best trial: 15. Best value: 0.781621:  60%|█████████████████████████████████████████████████████████████████████████████████                                                      | 18/30 [00:59<00:35,  2.95s/it]2026-07-16 08:23:00 - HeartDisease_RiskDiscovery - INFO - RandomForest initialized with resolved params: {'n_estimators': 900, 'max_depth': None, 'max_features': 'log2', 'min_samples_leaf': 7, 'class_weight': 'balanced', 'random_state': 45, 'n_jobs': -1}
2026-07-16 08:23:00 - HeartDisease_RiskDiscovery - INFO - Training RandomForest on 44795 samples
2026-07-16 08:23:02 - HeartDisease_RiskDiscovery - INFO - RandomForest training completed
[I 2026-07-16 08:23:03,090] Trial 18 finished with value: 0.7786907499529065 and parameters: {'use_max_depth': False, 'use_max_features_cat': True, 'max_features': 'log2', 'n_estimators': 900, 'min_samples_leaf': 7}. Best is trial 15 with value: 0.7816212994353017.
Best trial: 15. Best value: 0.781621:  63%|█████████████████████████████████████████████████████████████████████████████████████▌                                                 | 19/30 [01:02<00:32,  2.98s/it]2026-07-16 08:23:03 - HeartDisease_RiskDiscovery - INFO - RandomForest initialized with resolved params: {'n_estimators': 1000, 'max_depth': 13, 'max_features': 'log2', 'min_samples_leaf': 6, 'class_weight': 'balanced', 'random_state': 45, 'n_jobs': -1}
2026-07-16 08:23:03 - HeartDisease_RiskDiscovery - INFO - Training RandomForest on 44795 samples
2026-07-16 08:23:05 - HeartDisease_RiskDiscovery - INFO - RandomForest training completed
[I 2026-07-16 08:23:06,016] Trial 19 finished with value: 0.7809025973539663 and parameters: {'use_max_depth': True, 'max_depth': 13, 'use_max_features_cat': True, 'max_features': 'log2', 'n_estimators': 1000, 'min_samples_leaf': 6}. Best is trial 15 with value: 0.7816212994353017.
Best trial: 15. Best value: 0.781621:  67%|██████████████████████████████████████████████████████████████████████████████████████████                                             | 20/30 [01:05<00:29,  2.96s/it]2026-07-16 08:23:06 - HeartDisease_RiskDiscovery - INFO - RandomForest initialized with resolved params: {'n_estimators': 1150, 'max_depth': 20, 'max_features': 'sqrt', 'min_samples_leaf': 10, 'class_weight': 'balanced', 'random_state': 45, 'n_jobs': -1}
2026-07-16 08:23:06 - HeartDisease_RiskDiscovery - INFO - Training RandomForest on 44795 samples
2026-07-16 08:23:09 - HeartDisease_RiskDiscovery - INFO - RandomForest training completed
[I 2026-07-16 08:23:09,958] Trial 20 finished with value: 0.7802123522321842 and parameters: {'use_max_depth': True, 'max_depth': 20, 'use_max_features_cat': True, 'max_features': 'sqrt', 'n_estimators': 1150, 'min_samples_leaf': 10}. Best is trial 15 with value: 0.7816212994353017.
Best trial: 15. Best value: 0.781621:  70%|██████████████████████████████████████████████████████████████████████████████████████████████▌                                        | 21/30 [01:09<00:29,  3.26s/it]2026-07-16 08:23:09 - HeartDisease_RiskDiscovery - INFO - RandomForest initialized with resolved params: {'n_estimators': 1300, 'max_depth': 9, 'max_features': 'log2', 'min_samples_leaf': 11, 'class_weight': 'balanced', 'random_state': 45, 'n_jobs': -1}
2026-07-16 08:23:09 - HeartDisease_RiskDiscovery - INFO - Training RandomForest on 44795 samples
2026-07-16 08:23:12 - HeartDisease_RiskDiscovery - INFO - RandomForest training completed
