[I 2026-07-16 08:19:53,163] Trial 15 finished with value: 0.7830366476600634 and parameters: {'use_max_depth': True, 'max_depth': 6, 'use_max_features_cat': False, 'max_features_float': 0.7787638913512168, 'n_estimators': 950, 'min_samples_leaf': 13}. Best is trial 11 with value: 0.7839440030113902.
Best trial: 11. Best value: 0.783944:  53%|████████████████████████████████████████████████████████████████████████                                                               | 16/30 [01:04<00:51,  3.70s/it]2026-07-16 08:19:53 - HeartDisease_RiskDiscovery - INFO - RandomForest initialized with resolved params: {'n_estimators': 850, 'max_depth': 12, 'max_features': 0.6926230683206, 'min_samples_leaf': 8, 'class_weight': 'balanced', 'random_state': 43, 'n_jobs': -1}
2026-07-16 08:19:53 - HeartDisease_RiskDiscovery - INFO - Training RandomForest on 44794 samples
2026-07-16 08:19:59 - HeartDisease_RiskDiscovery - INFO - RandomForest training completed
[I 2026-07-16 08:19:59,187] Trial 16 finished with value: 0.7827024993337931 and parameters: {'use_max_depth': True, 'max_depth': 12, 'use_max_features_cat': False, 'max_features_float': 0.6926230683206, 'n_estimators': 850, 'min_samples_leaf': 8}. Best is trial 11 with value: 0.7839440030113902.
Best trial: 11. Best value: 0.783944:  57%|████████████████████████████████████████████████████████████████████████████▌                                                          | 17/30 [01:10<00:57,  4.40s/it]2026-07-16 08:19:59 - HeartDisease_RiskDiscovery - INFO - RandomForest initialized with resolved params: {'n_estimators': 1200, 'max_depth': 15, 'max_features': 'log2', 'min_samples_leaf': 6, 'class_weight': 'balanced', 'random_state': 43, 'n_jobs': -1}
2026-07-16 08:19:59 - HeartDisease_RiskDiscovery - INFO - Training RandomForest on 44794 samples
2026-07-16 08:20:02 - HeartDisease_RiskDiscovery - INFO - RandomForest training completed
[I 2026-07-16 08:20:02,910] Trial 17 finished with value: 0.7820821650169782 and parameters: {'use_max_depth': True, 'max_depth': 15, 'use_max_features_cat': True, 'max_features': 'log2', 'n_estimators': 1200, 'min_samples_leaf': 6}. Best is trial 11 with value: 0.7839440030113902.
Best trial: 11. Best value: 0.783944:  60%|█████████████████████████████████████████████████████████████████████████████████                                                      | 18/30 [01:14<00:50,  4.20s/it]2026-07-16 08:20:02 - HeartDisease_RiskDiscovery - INFO - RandomForest initialized with resolved params: {'n_estimators': 650, 'max_depth': None, 'max_features': 'sqrt', 'min_samples_leaf': 12, 'class_weight': 'balanced', 'random_state': 43, 'n_jobs': -1}
2026-07-16 08:20:02 - HeartDisease_RiskDiscovery - INFO - Training RandomForest on 44794 samples
2026-07-16 08:20:04 - HeartDisease_RiskDiscovery - INFO - RandomForest training completed
[I 2026-07-16 08:20:04,950] Trial 18 finished with value: 0.7821357320332737 and parameters: {'use_max_depth': False, 'use_max_features_cat': True, 'max_features': 'sqrt', 'n_estimators': 650, 'min_samples_leaf': 12}. Best is trial 11 with value: 0.7839440030113902.
Best trial: 11. Best value: 0.783944:  63%|█████████████████████████████████████████████████████████████████████████████████████▌                                                 | 19/30 [01:16<00:39,  3.55s/it]2026-07-16 08:20:04 - HeartDisease_RiskDiscovery - INFO - RandomForest initialized with resolved params: {'n_estimators': 900, 'max_depth': 9, 'max_features': 0.20329907854515022, 'min_samples_leaf': 9, 'class_weight': 'balanced', 'random_state': 43, 'n_jobs': -1}
2026-07-16 08:20:04 - HeartDisease_RiskDiscovery - INFO - Training RandomForest on 44794 samples
2026-07-16 08:20:07 - HeartDisease_RiskDiscovery - INFO - RandomForest training completed
[I 2026-07-16 08:20:07,151] Trial 19 finished with value: 0.7837715583033021 and parameters: {'use_max_depth': True, 'max_depth': 9, 'use_max_features_cat': False, 'max_features_float': 0.20329907854515022, 'n_estimators': 900, 'min_samples_leaf': 9}. Best is trial 11 with value: 0.7839440030113902.
Best trial: 11. Best value: 0.783944:  67%|██████████████████████████████████████████████████████████████████████████████████████████                                             | 20/30 [01:18<00:31,  3.14s/it]2026-07-16 08:20:07 - HeartDisease_RiskDiscovery - INFO - RandomForest initialized with resolved params: {'n_estimators': 900, 'max_depth': 10, 'max_features': 'log2', 'min_samples_leaf': 15, 'class_weight': 'balanced', 'random_state': 43, 'n_jobs': -1}
2026-07-16 08:20:07 - HeartDisease_RiskDiscovery - INFO - Training RandomForest on 44794 samples
2026-07-16 08:20:09 - HeartDisease_RiskDiscovery - INFO - RandomForest training completed
[I 2026-07-16 08:20:09,437] Trial 20 finished with value: 0.7835300638809732 and parameters: {'use_max_depth': True, 'max_depth': 10, 'use_max_features_cat': True, 'max_features': 'log2', 'n_estimators': 900, 'min_samples_leaf': 15}. Best is trial 11 with value: 0.7839440030113902.
Best trial: 11. Best value: 0.783944:  70%|██████████████████████████████████████████████████████████████████████████████████████████████▌                                        | 21/30 [01:20<00:25,  2.89s/it]2026-07-16 08:20:09 - HeartDisease_RiskDiscovery - INFO - RandomForest initialized with resolved params: {'n_estimators': 700, 'max_depth': 8, 'max_features': 0.24375328570617777, 'min_samples_leaf': 9, 'class_weight': 'balanced', 'random_state': 43, 'n_jobs': -1}
2026-07-16 08:20:09 - HeartDisease_RiskDiscovery - INFO - Training RandomForest on 44794 samples
2026-07-16 08:20:11 - HeartDisease_RiskDiscovery - INFO - RandomForest training completed
[I 2026-07-16 08:20:11,252] Trial 21 finished with value: 0.7841848204635415 and parameters: {'use_max_depth': True, 'max_depth': 8, 'use_max_features_cat': False, 'max_features_float': 0.24375328570617777, 'n_estimators': 700, 'min_samples_leaf': 9}. Best is trial 21 with value: 0.7841848204635415.
Best trial: 21. Best value: 0.784185:  73%|███████████████████████████████████████████████████████████████████████████████████████████████████                                    | 22/30 [01:22<00:20,  2.57s/it]2026-07-16 08:20:11 - HeartDisease_RiskDiscovery - INFO - RandomForest initialized with resolved params: {'n_estimators': 450, 'max_depth': 15, 'max_features': 0.22287214125893479, 'min_samples_leaf': 10, 'class_weight': 'balanced', 'random_state': 43, 'n_jobs': -1}
2026-07-16 08:20:11 - HeartDisease_RiskDiscovery - INFO - Training RandomForest on 44794 samples
2026-07-16 08:20:12 - HeartDisease_RiskDiscovery - INFO - RandomForest training completed
[I 2026-07-16 08:20:12,660] Trial 22 finished with value: 0.7827488069996589 and parameters: {'use_max_depth': True, 'max_depth': 15, 'use_max_features_cat': False, 'max_features_float': 0.22287214125893479, 'n_estimators': 450, 'min_samples_leaf': 10}. Best is trial 21 with value: 0.7841848204635415.
Best trial: 21. Best value: 0.784185:  77%|███████████████████████████████████████████████████████████████████████████████████████████████████████▌                               | 23/30 [01:23<00:15,  2.22s/it]2026-07-16 08:20:12 - HeartDisease_RiskDiscovery - INFO - RandomForest initialized with resolved params: {'n_estimators': 1150, 'max_depth': 9, 'max_features': 0.2226307898836917, 'min_samples_leaf': 9, 'class_weight': 'balanced', 'random_state': 43, 'n_jobs': -1}
2026-07-16 08:20:12 - HeartDisease_RiskDiscovery - INFO - Training RandomForest on 44794 samples
2026-07-16 08:20:15 - HeartDisease_RiskDiscovery - INFO - RandomForest training completed
[I 2026-07-16 08:20:15,454] Trial 23 finished with value: 0.7837442042876098 and parameters: {'use_max_depth': True, 'max_depth': 9, 'use_max_features_cat': False, 'max_features_float': 0.2226307898836917, 'n_estimators': 1150, 'min_samples_leaf': 9}. Best is trial 21 with value: 0.7841848204635415.
Best trial: 21. Best value: 0.784185:  80%|████████████████████████████████████████████████████████████████████████████████████████████████████████████                           | 24/30 [01:26<00:14,  2.39s/it]2026-07-16 08:20:15 - HeartDisease_RiskDiscovery - INFO - RandomForest initialized with resolved params: {'n_estimators': 1300, 'max_depth': 14, 'max_features': 0.5741700663482956, 'min_samples_leaf': 10, 'class_weight': 'balanced', 'random_state': 43, 'n_jobs': -1}
2026-07-16 08:20:15 - HeartDisease_RiskDiscovery - INFO - Training RandomForest on 44794 samples
2026-07-16 08:20:23 - HeartDisease_RiskDiscovery - INFO - RandomForest training completed
[I 2026-07-16 08:20:24,194] Trial 24 finished with value: 0.7823823694251707 and parameters: {'use_max_depth': True, 'max_depth': 14, 'use_max_features_cat': False, 'max_features_float': 0.5741700663482956, 'n_estimators': 1300, 'min_samples_leaf': 10}. Best is trial 21 with value: 0.7841848204635415.
Best trial: 21. Best value: 0.784185:  83%|████████████████████████████████████████████████████████████████████████████████████████████████████████████████▌                      | 25/30 [01:35<00:21,  4.30s/it]2026-07-16 08:20:24 - HeartDisease_RiskDiscovery - INFO - RandomForest initialized with resolved params: {'n_estimators': 650, 'max_depth': 8, 'max_features': 0.2820901770697348, 'min_samples_leaf': 7, 'class_weight': 'balanced', 'random_state': 43, 'n_jobs': -1}
2026-07-16 08:20:24 - HeartDisease_RiskDiscovery - INFO - Training RandomForest on 44794 samples
2026-07-16 08:20:25 - HeartDisease_RiskDiscovery - INFO - RandomForest training completed
[I 2026-07-16 08:20:26,062] Trial 25 finished with value: 0.7841858210206769 and parameters: {'use_max_depth': True, 'max_depth': 8, 'use_max_features_cat': False, 'max_features_float': 0.2820901770697348, 'n_estimators': 650, 'min_samples_leaf': 7}. Best is trial 25 with value: 0.7841858210206769.
Best trial: 25. Best value: 0.784186:  87%|█████████████████████████████████████████████████████████████████████████████████████████████████████████████████████                  | 26/30 [01:37<00:14,  3.57s/it]2026-07-16 08:20:26 - HeartDisease_RiskDiscovery - INFO - RandomForest initialized with resolved params: {'n_estimators': 600, 'max_depth': None, 'max_features': 0.3102588410847673, 'min_samples_leaf': 6, 'class_weight': 'balanced', 'random_state': 43, 'n_jobs': -1}
2026-07-16 08:20:26 - HeartDisease_RiskDiscovery - INFO - Training RandomForest on 44794 samples
2026-07-16 08:20:28 - HeartDisease_RiskDiscovery - INFO - RandomForest training completed
[I 2026-07-16 08:20:28,819] Trial 26 finished with value: 0.77863774424265 and parameters: {'use_max_depth': False, 'use_max_features_cat': False, 'max_features_float': 0.3102588410847673, 'n_estimators': 600, 'min_samples_leaf': 6}. Best is trial 25 with value: 0.7841858210206769.
Best trial: 25. Best value: 0.784186:  90%|█████████████████████████████████████████████████████████████████████████████████████████████████████████████████████████▌             | 27/30 [01:39<00:09,  3.32s/it]2026-07-16 08:20:28 - HeartDisease_RiskDiscovery - INFO - RandomForest initialized with resolved params: {'n_estimators': 450, 'max_depth': 7, 'max_features': 0.5936308853588508, 'min_samples_leaf': 7, 'class_weight': 'balanced', 'random_state': 43, 'n_jobs': -1}
2026-07-16 08:20:28 - HeartDisease_RiskDiscovery - INFO - Training RandomForest on 44794 samples
2026-07-16 08:20:30 - HeartDisease_RiskDiscovery - INFO - RandomForest training completed
[I 2026-07-16 08:20:30,759] Trial 27 finished with value: 0.7839807079337999 and parameters: {'use_max_depth': True, 'max_depth': 7, 'use_max_features_cat': False, 'max_features_float': 0.5936308853588508, 'n_estimators': 450, 'min_samples_leaf': 7}. Best is trial 25 with value: 0.7841858210206769.
Best trial: 25. Best value: 0.784186:  93%|██████████████████████████████████████████████████████████████████████████████████████████████████████████████████████████████         | 28/30 [01:41<00:05,  2.91s/it]2026-07-16 08:20:30 - HeartDisease_RiskDiscovery - INFO - RandomForest initialized with resolved params: {'n_estimators': 400, 'max_depth': 6, 'max_features': 0.5411962428311139, 'min_samples_leaf': 3, 'class_weight': 'balanced', 'random_state': 43, 'n_jobs': -1}
2026-07-16 08:20:30 - HeartDisease_RiskDiscovery - INFO - Training RandomForest on 44794 samples
2026-07-16 08:20:32 - HeartDisease_RiskDiscovery - INFO - RandomForest training completed
[I 2026-07-16 08:20:32,203] Trial 28 finished with value: 0.7827422850366467 and parameters: {'use_max_depth': True, 'max_depth': 6, 'use_max_features_cat': False, 'max_features_float': 0.5411962428311139, 'n_estimators': 400, 'min_samples_leaf': 3}. Best is trial 25 with value: 0.7841858210206769.
Best trial: 25. Best value: 0.784186:  97%|██████████████████████████████████████████████████████████████████████████████████████████████████████████████████████████████████▌    | 29/30 [01:43<00:02,  2.47s/it]2026-07-16 08:20:32 - HeartDisease_RiskDiscovery - INFO - RandomForest initialized with resolved params: {'n_estimators': 350, 'max_depth': None, 'max_features': 0.3117958343127465, 'min_samples_leaf': 7, 'class_weight': 'balanced', 'random_state': 43, 'n_jobs': -1}
2026-07-16 08:20:32 - HeartDisease_RiskDiscovery - INFO - Training RandomForest on 44794 samples
2026-07-16 08:20:33 - HeartDisease_RiskDiscovery - INFO - RandomForest training completed
[I 2026-07-16 08:20:33,815] Trial 29 finished with value: 0.7794894179440941 and parameters: {'use_max_depth': False, 'use_max_features_cat': False, 'max_features_float': 0.3117958343127465, 'n_estimators': 350, 'min_samples_leaf': 7}. Best is trial 25 with value: 0.7841858210206769.
Best trial: 25. Best value: 0.784186: 100%|███████████████████████████████████████████████████████████████████████████████████████████████████████████████████████████████████████| 30/30 [01:44<00:00,  3.50s/it]
2026-07-16 08:20:33 - HeartDisease_RiskDiscovery - INFO - RandomForest initialized with resolved params: {'n_estimators': 650, 'max_depth': 8, 'max_features': 0.2820901770697348, 'min_samples_leaf': 7, 'class_weight': 'balanced', 'random_state': 43, 'n_jobs': -1}
2026-07-16 08:20:33 - HeartDisease_RiskDiscovery - INFO - Training RandomForest on 44794 samples
2026-07-16 08:20:35 - HeartDisease_RiskDiscovery - INFO - RandomForest training completed
2026-07-16 08:20:36 - HeartDisease_RiskDiscovery - INFO - Feature importance saved to artifacts/Model/rf/fold_1/feature_importance.json
2026-07-16 08:20:36 - HeartDisease_RiskDiscovery - INFO - RandomForest saved to artifacts/Model/rf/fold_1/model.joblib
[I 2026-07-16 08:20:36,489] A new study created in memory with name: no-name-2f7cd7a2-6910-474b-b980-405321754ea6
  0%|                                                                                                                                                                                      | 0/30 [00:00<?, ?it/s]2026-07-16 08:20:36 - HeartDisease_RiskDiscovery - INFO - RandomForest initialized with resolved params: {'n_estimators': 750, 'max_depth': 24, 'max_features': 'sqrt', 'min_samples_leaf': 8, 'class_weight': 'balanced', 'random_state': 44, 'n_jobs': -1}
2026-07-16 08:20:36 - HeartDisease_RiskDiscovery - INFO - Training RandomForest on 44794 samples
2026-07-16 08:20:38 - HeartDisease_RiskDiscovery - INFO - RandomForest training completed
[I 2026-07-16 08:20:38,931] Trial 0 finished with value: 0.788749691346381 and parameters: {'use_max_depth': True, 'max_depth': 24, 'use_max_features_cat': True, 'max_features': 'sqrt', 'n_estimators': 750, 'min_samples_leaf': 8}. Best is trial 0 with value: 0.788749691346381.
Best trial: 0. Best value: 0.78875:   3%|████▌                                                                                                                                     | 1/30 [00:02<01:10,  2.44s/it]2026-07-16 08:20:38 - HeartDisease_RiskDiscovery - INFO - RandomForest initialized with resolved params: {'n_estimators': 1450, 'max_depth': None, 'max_features': 'log2', 'min_samples_leaf': 15, 'class_weight': 'balanced', 'random_state': 44, 'n_jobs': -1}
2026-07-16 08:20:38 - HeartDisease_RiskDiscovery - INFO - Training RandomForest on 44794 samples
2026-07-16 08:20:42 - HeartDisease_RiskDiscovery - INFO - RandomForest training completed
[I 2026-07-16 08:20:43,229] Trial 1 finished with value: 0.790121620963521 and parameters: {'use_max_depth': False, 'use_max_features_cat': True, 'max_features': 'log2', 'n_estimators': 1450, 'min_samples_leaf': 15}. Best is trial 1 with value: 0.790121620963521.
Best trial: 1. Best value: 0.790122:   7%|█████████▏                                                                                                                               | 2/30 [00:06<01:38,  3.53s/it]2026-07-16 08:20:43 - HeartDisease_RiskDiscovery - INFO - RandomForest initialized with resolved params: {'n_estimators': 500, 'max_depth': 11, 'max_features': 'log2', 'min_samples_leaf': 10, 'class_weight': 'balanced', 'random_state': 44, 'n_jobs': -1}
2026-07-16 08:20:43 - HeartDisease_RiskDiscovery - INFO - Training RandomForest on 44794 samples
2026-07-16 08:20:44 - HeartDisease_RiskDiscovery - INFO - RandomForest training completed
[I 2026-07-16 08:20:44,582] Trial 2 finished with value: 0.7913818299960927 and parameters: {'use_max_depth': True, 'max_depth': 11, 'use_max_features_cat': True, 'max_features': 'log2', 'n_estimators': 500, 'min_samples_leaf': 10}. Best is trial 2 with value: 0.7913818299960927.
Best trial: 2. Best value: 0.791382:  10%|█████████████▋                                                                                                                           | 3/30 [00:08<01:08,  2.54s/it]2026-07-16 08:20:44 - HeartDisease_RiskDiscovery - INFO - RandomForest initialized with resolved params: {'n_estimators': 450, 'max_depth': 20, 'max_features': 0.2832183687921849, 'min_samples_leaf': 7, 'class_weight': 'balanced', 'random_state': 44, 'n_jobs': -1}
2026-07-16 08:20:44 - HeartDisease_RiskDiscovery - INFO - Training RandomForest on 44794 samples
2026-07-16 08:20:46 - HeartDisease_RiskDiscovery - INFO - RandomForest training completed
[I 2026-07-16 08:20:46,604] Trial 3 finished with value: 0.7878782636208691 and parameters: {'use_max_depth': True, 'max_depth': 20, 'use_max_features_cat': False, 'max_features_float': 0.2832183687921849, 'n_estimators': 450, 'min_samples_leaf': 7}. Best is trial 2 with value: 0.7913818299960927.
Best trial: 2. Best value: 0.791382:  13%|██████████████████▎                                                                                                                      | 4/30 [00:10<01:00,  2.33s/it]2026-07-16 08:20:46 - HeartDisease_RiskDiscovery - INFO - RandomForest initialized with resolved params: {'n_estimators': 1150, 'max_depth': None, 'max_features': 'sqrt', 'min_samples_leaf': 2, 'class_weight': 'balanced', 'random_state': 44, 'n_jobs': -1}
2026-07-16 08:20:46 - HeartDisease_RiskDiscovery - INFO - Training RandomForest on 44794 samples
2026-07-16 08:20:51 - HeartDisease_RiskDiscovery - INFO - RandomForest training completed
[I 2026-07-16 08:20:51,810] Trial 4 finished with value: 0.7783342460303925 and parameters: {'use_max_depth': False, 'use_max_features_cat': True, 'max_features': 'sqrt', 'n_estimators': 1150, 'min_samples_leaf': 2}. Best is trial 2 with value: 0.7913818299960927.
Best trial: 2. Best value: 0.791382:  17%|██████████████████████▊                                                                                                                  | 5/30 [00:15<01:24,  3.37s/it]2026-07-16 08:20:51 - HeartDisease_RiskDiscovery - INFO - RandomForest initialized with resolved params: {'n_estimators': 300, 'max_depth': 26, 'max_features': 'sqrt', 'min_samples_leaf': 7, 'class_weight': 'balanced', 'random_state': 44, 'n_jobs': -1}
2026-07-16 08:20:51 - HeartDisease_RiskDiscovery - INFO - Training RandomForest on 44794 samples
2026-07-16 08:20:52 - HeartDisease_RiskDiscovery - INFO - RandomForest training completed
[I 2026-07-16 08:20:52,861] Trial 5 finished with value: 0.788291158473807 and parameters: {'use_max_depth': True, 'max_depth': 26, 'use_max_features_cat': True, 'max_features': 'sqrt', 'n_estimators': 300, 'min_samples_leaf': 7}. Best is trial 2 with value: 0.7913818299960927.
Best trial: 2. Best value: 0.791382:  20%|███████████████████████████▍                                                                                                             | 6/30 [00:16<01:01,  2.58s/it]2026-07-16 08:20:52 - HeartDisease_RiskDiscovery - INFO - RandomForest initialized with resolved params: {'n_estimators': 350, 'max_depth': 9, 'max_features': 'sqrt', 'min_samples_leaf': 5, 'class_weight': 'balanced', 'random_state': 44, 'n_jobs': -1}
2026-07-16 08:20:52 - HeartDisease_RiskDiscovery - INFO - Training RandomForest on 44794 samples
2026-07-16 08:20:53 - HeartDisease_RiskDiscovery - INFO - RandomForest training completed
[I 2026-07-16 08:20:53,724] Trial 6 finished with value: 0.7910609445742854 and parameters: {'use_max_depth': True, 'max_depth': 9, 'use_max_features_cat': True, 'max_features': 'sqrt', 'n_estimators': 350, 'min_samples_leaf': 5}. Best is trial 2 with value: 0.7913818299960927.
Best trial: 2. Best value: 0.791382:  23%|███████████████████████████████▉                                                                                                         | 7/30 [00:17<00:46,  2.02s/it]2026-07-16 08:20:53 - HeartDisease_RiskDiscovery - INFO - RandomForest initialized with resolved params: {'n_estimators': 1250, 'max_depth': None, 'max_features': 0.2762277292489188, 'min_samples_leaf': 5, 'class_weight': 'balanced', 'random_state': 44, 'n_jobs': -1}
2026-07-16 08:20:53 - HeartDisease_RiskDiscovery - INFO - Training RandomForest on 44794 samples
2026-07-16 08:20:59 - HeartDisease_RiskDiscovery - INFO - RandomForest training completed
