[I 2026-07-16 08:25:16,648] Trial 29 finished with value: 0.7741270606709434 and parameters: {'use_max_depth': False, 'use_max_features_cat': True, 'max_features': 'log2', 'n_estimators': 550, 'min_samples_leaf': 6}. Best is trial 15 with value: 0.7780556028707712.
Best trial: 15. Best value: 0.778056: 100%|███████████████████████████████████████████████████████████████████████████████████████████████████████████████████████████████████████| 30/30 [01:28<00:00,  2.96s/it]
2026-07-16 08:25:16 - HeartDisease_RiskDiscovery - INFO - RandomForest initialized with resolved params: {'n_estimators': 850, 'max_depth': 11, 'max_features': 'sqrt', 'min_samples_leaf': 7, 'class_weight': 'balanced', 'random_state': 46, 'n_jobs': -1}
2026-07-16 08:25:16 - HeartDisease_RiskDiscovery - INFO - Training RandomForest on 44795 samples
2026-07-16 08:25:18 - HeartDisease_RiskDiscovery - INFO - RandomForest training completed
2026-07-16 08:25:19 - HeartDisease_RiskDiscovery - INFO - Feature importance saved to artifacts/Model/rf/fold_4/feature_importance.json
2026-07-16 08:25:19 - HeartDisease_RiskDiscovery - INFO - RandomForest saved to artifacts/Model/rf/fold_4/model.joblib
2026-07-16 08:25:20 - HeartDisease_RiskDiscovery - INFO - RandomForest initialized with resolved params: {'n_estimators': 500, 'max_depth': 11, 'max_features': 'log2', 'min_samples_leaf': 10, 'class_weight': 'balanced', 'random_state': 42, 'n_jobs': -1}
2026-07-16 08:25:20 - HeartDisease_RiskDiscovery - INFO - Training RandomForest on 55993 samples
2026-07-16 08:25:22 - HeartDisease_RiskDiscovery - INFO - RandomForest training completed
2026-07-16 08:25:22 - HeartDisease_RiskDiscovery - INFO - Feature importance saved to artifacts/Model/rf/final_model/feature_importance.json
2026-07-16 08:25:22 - HeartDisease_RiskDiscovery - INFO - RandomForest saved to artifacts/Model/rf/final_model/model.joblib
RF → artifacts/Model/rf/
python3 -m src.modeling --config configs/tabnet_baseline.yaml    --model tabnet
2026-07-16 08:25:24.193168: I tensorflow/core/util/port.cc:153] oneDNN custom operations are on. You may see slightly different numerical results due to floating-point round-off errors from different computation orders. To turn them off, set the environment variable `TF_ENABLE_ONEDNN_OPTS=0`.
2026-07-16 08:25:24.193573: I external/local_xla/xla/tsl/cuda/cudart_stub.cc:32] Could not find cuda drivers on your machine, GPU will not be used.
2026-07-16 08:25:24.195679: I external/local_xla/xla/tsl/cuda/cudart_stub.cc:32] Could not find cuda drivers on your machine, GPU will not be used.
2026-07-16 08:25:24.201720: E external/local_xla/xla/stream_executor/cuda/cuda_fft.cc:485] Unable to register cuFFT factory: Attempting to register factory for plugin cuFFT when one has already been registered
2026-07-16 08:25:24.211631: E external/local_xla/xla/stream_executor/cuda/cuda_dnn.cc:8454] Unable to register cuDNN factory: Attempting to register factory for plugin cuDNN when one has already been registered
2026-07-16 08:25:24.214470: E external/local_xla/xla/stream_executor/cuda/cuda_blas.cc:1452] Unable to register cuBLAS factory: Attempting to register factory for plugin cuBLAS when one has already been registered
2026-07-16 08:25:24.221696: I tensorflow/core/platform/cpu_feature_guard.cc:210] This TensorFlow binary is optimized to use available CPU instructions in performance-critical operations.
To enable the following instructions: AVX2 AVX_VNNI FMA, in other operations, rebuild TensorFlow with the appropriate compiler flags.
2026-07-16 08:25:24.649264: W tensorflow/compiler/tf2tensorrt/utils/py_utils.cc:38] TF-TRT Warning: Could not find TensorRT
WARNING: All log messages before absl::InitializeLog() is called are written to STDERR
I0000 00:00:1784165125.343034   12685 cuda_executor.cc:1015] successful NUMA node read from SysFS had negative value (-1), but there must be at least one NUMA node, so returning NUMA node zero. See more at https://github.com/torvalds/linux/blob/v6.0/Documentation/ABI/testing/sysfs-bus-pci#L344-L355
2026-07-16 08:25:25.345492: W tensorflow/core/common_runtime/gpu/gpu_device.cc:2343] Cannot dlopen some GPU libraries. Please make sure the missing libraries mentioned above are installed properly if you would like to use GPU. Follow the guide at https://www.tensorflow.org/install/gpu for how to download and setup the required libraries for your platform.
Skipping registering GPU devices...
2026-07-16 08:25:25 - HeartDisease_RiskDiscovery - INFO - TabNet initialized: input_dim=19, params={'n_d': 12, 'n_a': 12, 'n_steps': 4, 'gamma': 1.625957341248133, 'lambda_sparse': 0.0005927172136384618, 'batch_size': 128, 'epochs': 80, 'lr': 0.0024260876636955963, 'dropout': 0.15580833938492766}
2026-07-16 08:25:25 - HeartDisease_RiskDiscovery - INFO - Training TabNet on 44794 samples
Epoch 1/80
/home/loint/Workings/InternalProjects/DataAnalysis/CardiovascularRiskDetectionSystem/.venv/lib/python3.10/site-packages/keras/src/optimizers/base_optimizer.py:870: UserWarning: Gradients do not exist for variables ['tab_net_model/tab_net_block/feature_transformer/dense_1/kernel', 'tab_net_model/tab_net_block/feature_transformer/batch_normalization_2/gamma', 'tab_net_model/tab_net_block/feature_transformer/batch_normalization_2/beta'] when minimizing the loss. If using `model.compile()`, did you forget to provide a `loss` argument?
  warnings.warn(
350/350 ━━━━━━━━━━━━━━━━━━━━ 6s 6ms/step - accuracy: 0.6823 - loss: 0.6289 - val_accuracy: 0.7167 - val_loss: 0.5662 - val_pr_auc: 0.7668
Epoch 2/80
350/350 ━━━━━━━━━━━━━━━━━━━━ 1s 4ms/step - accuracy: 0.7244 - loss: 0.5615 - val_accuracy: 0.7318 - val_loss: 0.5510 - val_pr_auc: 0.7732
Epoch 3/80
350/350 ━━━━━━━━━━━━━━━━━━━━ 1s 4ms/step - accuracy: 0.7294 - loss: 0.5544 - val_accuracy: 0.7330 - val_loss: 0.5489 - val_pr_auc: 0.7765
Epoch 4/80
350/350 ━━━━━━━━━━━━━━━━━━━━ 1s 4ms/step - accuracy: 0.7307 - loss: 0.5515 - val_accuracy: 0.7341 - val_loss: 0.5482 - val_pr_auc: 0.7779
Epoch 5/80
350/350 ━━━━━━━━━━━━━━━━━━━━ 1s 4ms/step - accuracy: 0.7326 - loss: 0.5509 - val_accuracy: 0.7348 - val_loss: 0.5475 - val_pr_auc: 0.7794
Epoch 6/80
350/350 ━━━━━━━━━━━━━━━━━━━━ 1s 4ms/step - accuracy: 0.7333 - loss: 0.5494 - val_accuracy: 0.7360 - val_loss: 0.5460 - val_pr_auc: 0.7815
Epoch 7/80
350/350 ━━━━━━━━━━━━━━━━━━━━ 1s 4ms/step - accuracy: 0.7330 - loss: 0.5492 - val_accuracy: 0.7355 - val_loss: 0.5464 - val_pr_auc: 0.7816
Epoch 8/80
350/350 ━━━━━━━━━━━━━━━━━━━━ 1s 4ms/step - accuracy: 0.7339 - loss: 0.5482 - val_accuracy: 0.7363 - val_loss: 0.5460 - val_pr_auc: 0.7825
Epoch 9/80
350/350 ━━━━━━━━━━━━━━━━━━━━ 1s 4ms/step - accuracy: 0.7347 - loss: 0.5463 - val_accuracy: 0.7362 - val_loss: 0.5452 - val_pr_auc: 0.7832
Epoch 10/80
350/350 ━━━━━━━━━━━━━━━━━━━━ 1s 4ms/step - accuracy: 0.7353 - loss: 0.5473 - val_accuracy: 0.7353 - val_loss: 0.5459 - val_pr_auc: 0.7842
Epoch 11/80
350/350 ━━━━━━━━━━━━━━━━━━━━ 1s 4ms/step - accuracy: 0.7356 - loss: 0.5469 - val_accuracy: 0.7358 - val_loss: 0.5457 - val_pr_auc: 0.7850
Epoch 12/80
350/350 ━━━━━━━━━━━━━━━━━━━━ 1s 4ms/step - accuracy: 0.7357 - loss: 0.5464 - val_accuracy: 0.7375 - val_loss: 0.5456 - val_pr_auc: 0.7852
Epoch 13/80
350/350 ━━━━━━━━━━━━━━━━━━━━ 1s 4ms/step - accuracy: 0.7359 - loss: 0.5455 - val_accuracy: 0.7363 - val_loss: 0.5451 - val_pr_auc: 0.7857
Epoch 14/80
350/350 ━━━━━━━━━━━━━━━━━━━━ 1s 4ms/step - accuracy: 0.7362 - loss: 0.5456 - val_accuracy: 0.7370 - val_loss: 0.5450 - val_pr_auc: 0.7856
Epoch 15/80
350/350 ━━━━━━━━━━━━━━━━━━━━ 1s 3ms/step - accuracy: 0.7360 - loss: 0.5453 - val_accuracy: 0.7375 - val_loss: 0.5451 - val_pr_auc: 0.7864
Epoch 16/80
350/350 ━━━━━━━━━━━━━━━━━━━━ 1s 4ms/step - accuracy: 0.7363 - loss: 0.5447 - val_accuracy: 0.7369 - val_loss: 0.5452 - val_pr_auc: 0.7861
Epoch 17/80
350/350 ━━━━━━━━━━━━━━━━━━━━ 1s 3ms/step - accuracy: 0.7347 - loss: 0.5443 - val_accuracy: 0.7370 - val_loss: 0.5444 - val_pr_auc: 0.7867
Epoch 18/80
350/350 ━━━━━━━━━━━━━━━━━━━━ 1s 4ms/step - accuracy: 0.7374 - loss: 0.5446 - val_accuracy: 0.7360 - val_loss: 0.5447 - val_pr_auc: 0.7863
Epoch 19/80
350/350 ━━━━━━━━━━━━━━━━━━━━ 1s 4ms/step - accuracy: 0.7355 - loss: 0.5449 - val_accuracy: 0.7373 - val_loss: 0.5448 - val_pr_auc: 0.7872
Epoch 20/80
350/350 ━━━━━━━━━━━━━━━━━━━━ 1s 4ms/step - accuracy: 0.7368 - loss: 0.5444 - val_accuracy: 0.7372 - val_loss: 0.5444 - val_pr_auc: 0.7865
Epoch 21/80
350/350 ━━━━━━━━━━━━━━━━━━━━ 1s 4ms/step - accuracy: 0.7356 - loss: 0.5440 - val_accuracy: 0.7367 - val_loss: 0.5444 - val_pr_auc: 0.7869
Epoch 22/80
350/350 ━━━━━━━━━━━━━━━━━━━━ 1s 4ms/step - accuracy: 0.7369 - loss: 0.5433 - val_accuracy: 0.7360 - val_loss: 0.5444 - val_pr_auc: 0.7863
Epoch 23/80
350/350 ━━━━━━━━━━━━━━━━━━━━ 1s 4ms/step - accuracy: 0.7363 - loss: 0.5444 - val_accuracy: 0.7366 - val_loss: 0.5445 - val_pr_auc: 0.7876
Epoch 24/80
350/350 ━━━━━━━━━━━━━━━━━━━━ 1s 4ms/step - accuracy: 0.7373 - loss: 0.5437 - val_accuracy: 0.7377 - val_loss: 0.5439 - val_pr_auc: 0.7875
Epoch 25/80
350/350 ━━━━━━━━━━━━━━━━━━━━ 1s 4ms/step - accuracy: 0.7375 - loss: 0.5433 - val_accuracy: 0.7378 - val_loss: 0.5437 - val_pr_auc: 0.7877
Epoch 26/80
350/350 ━━━━━━━━━━━━━━━━━━━━ 1s 4ms/step - accuracy: 0.7361 - loss: 0.5434 - val_accuracy: 0.7371 - val_loss: 0.5441 - val_pr_auc: 0.7873
Epoch 27/80
350/350 ━━━━━━━━━━━━━━━━━━━━ 1s 3ms/step - accuracy: 0.7369 - loss: 0.5440 - val_accuracy: 0.7375 - val_loss: 0.5438 - val_pr_auc: 0.7871
Epoch 28/80
350/350 ━━━━━━━━━━━━━━━━━━━━ 1s 4ms/step - accuracy: 0.7358 - loss: 0.5433 - val_accuracy: 0.7380 - val_loss: 0.5437 - val_pr_auc: 0.7878
Epoch 29/80
350/350 ━━━━━━━━━━━━━━━━━━━━ 1s 4ms/step - accuracy: 0.7377 - loss: 0.5432 - val_accuracy: 0.7384 - val_loss: 0.5436 - val_pr_auc: 0.7876
Epoch 30/80
350/350 ━━━━━━━━━━━━━━━━━━━━ 1s 4ms/step - accuracy: 0.7370 - loss: 0.5429 - val_accuracy: 0.7387 - val_loss: 0.5435 - val_pr_auc: 0.7875
Epoch 31/80
350/350 ━━━━━━━━━━━━━━━━━━━━ 1s 4ms/step - accuracy: 0.7371 - loss: 0.5422 - val_accuracy: 0.7379 - val_loss: 0.5438 - val_pr_auc: 0.7875
Epoch 32/80
350/350 ━━━━━━━━━━━━━━━━━━━━ 1s 4ms/step - accuracy: 0.7366 - loss: 0.5424 - val_accuracy: 0.7386 - val_loss: 0.5435 - val_pr_auc: 0.7879
Epoch 33/80
350/350 ━━━━━━━━━━━━━━━━━━━━ 1s 4ms/step - accuracy: 0.7372 - loss: 0.5433 - val_accuracy: 0.7391 - val_loss: 0.5437 - val_pr_auc: 0.7869
Epoch 34/80
350/350 ━━━━━━━━━━━━━━━━━━━━ 1s 4ms/step - accuracy: 0.7370 - loss: 0.5422 - val_accuracy: 0.7384 - val_loss: 0.5436 - val_pr_auc: 0.7872
Epoch 35/80
350/350 ━━━━━━━━━━━━━━━━━━━━ 1s 4ms/step - accuracy: 0.7374 - loss: 0.5420 - val_accuracy: 0.7379 - val_loss: 0.5432 - val_pr_auc: 0.7885
Epoch 36/80
350/350 ━━━━━━━━━━━━━━━━━━━━ 1s 4ms/step - accuracy: 0.7374 - loss: 0.5428 - val_accuracy: 0.7384 - val_loss: 0.5435 - val_pr_auc: 0.7875
Epoch 37/80
350/350 ━━━━━━━━━━━━━━━━━━━━ 1s 4ms/step - accuracy: 0.7374 - loss: 0.5425 - val_accuracy: 0.7380 - val_loss: 0.5436 - val_pr_auc: 0.7880
Epoch 38/80
350/350 ━━━━━━━━━━━━━━━━━━━━ 1s 4ms/step - accuracy: 0.7374 - loss: 0.5420 - val_accuracy: 0.7377 - val_loss: 0.5433 - val_pr_auc: 0.7868
Epoch 39/80
350/350 ━━━━━━━━━━━━━━━━━━━━ 1s 4ms/step - accuracy: 0.7362 - loss: 0.5428 - val_accuracy: 0.7388 - val_loss: 0.5434 - val_pr_auc: 0.7876
Epoch 40/80
350/350 ━━━━━━━━━━━━━━━━━━━━ 1s 4ms/step - accuracy: 0.7377 - loss: 0.5429 - val_accuracy: 0.7380 - val_loss: 0.5431 - val_pr_auc: 0.7883
Epoch 41/80
350/350 ━━━━━━━━━━━━━━━━━━━━ 1s 4ms/step - accuracy: 0.7370 - loss: 0.5419 - val_accuracy: 0.7379 - val_loss: 0.5436 - val_pr_auc: 0.7875
Epoch 42/80
350/350 ━━━━━━━━━━━━━━━━━━━━ 1s 4ms/step - accuracy: 0.7373 - loss: 0.5422 - val_accuracy: 0.7386 - val_loss: 0.5434 - val_pr_auc: 0.7877
Epoch 43/80
350/350 ━━━━━━━━━━━━━━━━━━━━ 1s 4ms/step - accuracy: 0.7368 - loss: 0.5420 - val_accuracy: 0.7379 - val_loss: 0.5433 - val_pr_auc: 0.7886
Epoch 44/80
350/350 ━━━━━━━━━━━━━━━━━━━━ 1s 4ms/step - accuracy: 0.7372 - loss: 0.5420 - val_accuracy: 0.7384 - val_loss: 0.5436 - val_pr_auc: 0.7877
Epoch 45/80
350/350 ━━━━━━━━━━━━━━━━━━━━ 1s 4ms/step - accuracy: 0.7371 - loss: 0.5416 - val_accuracy: 0.7375 - val_loss: 0.5435 - val_pr_auc: 0.7877
Epoch 46/80
350/350 ━━━━━━━━━━━━━━━━━━━━ 1s 4ms/step - accuracy: 0.7382 - loss: 0.5414 - val_accuracy: 0.7385 - val_loss: 0.5437 - val_pr_auc: 0.7875
Epoch 47/80
350/350 ━━━━━━━━━━━━━━━━━━━━ 1s 4ms/step - accuracy: 0.7383 - loss: 0.5421 - val_accuracy: 0.7375 - val_loss: 0.5437 - val_pr_auc: 0.7875
Epoch 48/80
350/350 ━━━━━━━━━━━━━━━━━━━━ 1s 4ms/step - accuracy: 0.7373 - loss: 0.5420 - val_accuracy: 0.7385 - val_loss: 0.5434 - val_pr_auc: 0.7873
Epoch 49/80
350/350 ━━━━━━━━━━━━━━━━━━━━ 1s 3ms/step - accuracy: 0.7380 - loss: 0.5418 - val_accuracy: 0.7375 - val_loss: 0.5435 - val_pr_auc: 0.7873
Epoch 50/80
350/350 ━━━━━━━━━━━━━━━━━━━━ 1s 4ms/step - accuracy: 0.7371 - loss: 0.5414 - val_accuracy: 0.7383 - val_loss: 0.5442 - val_pr_auc: 0.7870
2026-07-16 08:26:33 - HeartDisease_RiskDiscovery - INFO - TabNet training completed
2026-07-16 08:26:34 - HeartDisease_RiskDiscovery - INFO - TabNet weights saved to artifacts/Model/tabnet/fold_0/model.weights.h5 (weights only format: .weights.h5)
2026-07-16 08:26:35 - HeartDisease_RiskDiscovery - INFO - TabNet initialized: input_dim=19, params={'n_d': 12, 'n_a': 12, 'n_steps': 4, 'gamma': 1.625957341248133, 'lambda_sparse': 0.0005927172136384618, 'batch_size': 128, 'epochs': 80, 'lr': 0.0024260876636955963, 'dropout': 0.15580833938492766}
2026-07-16 08:26:35 - HeartDisease_RiskDiscovery - INFO - Training TabNet on 44794 samples
Epoch 1/80
/home/loint/Workings/InternalProjects/DataAnalysis/CardiovascularRiskDetectionSystem/.venv/lib/python3.10/site-packages/keras/src/optimizers/base_optimizer.py:870: UserWarning: Gradients do not exist for variables ['tab_net_model_1/tab_net_block_1/feature_transformer_5/dense_16/kernel', 'tab_net_model_1/tab_net_block_1/feature_transformer_5/batch_normalization_17/gamma', 'tab_net_model_1/tab_net_block_1/feature_transformer_5/batch_normalization_17/beta'] when minimizing the loss. If using `model.compile()`, did you forget to provide a `loss` argument?
  warnings.warn(
350/350 ━━━━━━━━━━━━━━━━━━━━ 5s 5ms/step - accuracy: 0.6937 - loss: 0.6214 - val_accuracy: 0.7228 - val_loss: 0.5613 - val_pr_auc: 0.7809
Epoch 2/80
350/350 ━━━━━━━━━━━━━━━━━━━━ 1s 4ms/step - accuracy: 0.7232 - loss: 0.5630 - val_accuracy: 0.7280 - val_loss: 0.5480 - val_pr_auc: 0.7830
Epoch 3/80
350/350 ━━━━━━━━━━━━━━━━━━━━ 1s 4ms/step - accuracy: 0.7288 - loss: 0.5557 - val_accuracy: 0.7309 - val_loss: 0.5461 - val_pr_auc: 0.7838
Epoch 4/80
350/350 ━━━━━━━━━━━━━━━━━━━━ 1s 4ms/step - accuracy: 0.7309 - loss: 0.5531 - val_accuracy: 0.7312 - val_loss: 0.5449 - val_pr_auc: 0.7844
Epoch 5/80
350/350 ━━━━━━━━━━━━━━━━━━━━ 1s 4ms/step - accuracy: 0.7321 - loss: 0.5514 - val_accuracy: 0.7322 - val_loss: 0.5442 - val_pr_auc: 0.7853
Epoch 6/80
350/350 ━━━━━━━━━━━━━━━━━━━━ 1s 4ms/step - accuracy: 0.7328 - loss: 0.5502 - val_accuracy: 0.7327 - val_loss: 0.5434 - val_pr_auc: 0.7856
Epoch 7/80
350/350 ━━━━━━━━━━━━━━━━━━━━ 1s 4ms/step - accuracy: 0.7331 - loss: 0.5494 - val_accuracy: 0.7318 - val_loss: 0.5429 - val_pr_auc: 0.7845
Epoch 8/80
350/350 ━━━━━━━━━━━━━━━━━━━━ 1s 4ms/step - accuracy: 0.7345 - loss: 0.5489 - val_accuracy: 0.7333 - val_loss: 0.5423 - val_pr_auc: 0.7847
Epoch 9/80
350/350 ━━━━━━━━━━━━━━━━━━━━ 1s 4ms/step - accuracy: 0.7341 - loss: 0.5487 - val_accuracy: 0.7344 - val_loss: 0.5420 - val_pr_auc: 0.7860
Epoch 10/80
350/350 ━━━━━━━━━━━━━━━━━━━━ 1s 4ms/step - accuracy: 0.7351 - loss: 0.5478 - val_accuracy: 0.7341 - val_loss: 0.5414 - val_pr_auc: 0.7859
Epoch 11/80
350/350 ━━━━━━━━━━━━━━━━━━━━ 1s 4ms/step - accuracy: 0.7347 - loss: 0.5474 - val_accuracy: 0.7344 - val_loss: 0.5414 - val_pr_auc: 0.7858
Epoch 12/80
350/350 ━━━━━━━━━━━━━━━━━━━━ 1s 4ms/step - accuracy: 0.7352 - loss: 0.5470 - val_accuracy: 0.7345 - val_loss: 0.5413 - val_pr_auc: 0.7856
Epoch 13/80
350/350 ━━━━━━━━━━━━━━━━━━━━ 1s 4ms/step - accuracy: 0.7348 - loss: 0.5468 - val_accuracy: 0.7351 - val_loss: 0.5411 - val_pr_auc: 0.7863
Epoch 14/80
350/350 ━━━━━━━━━━━━━━━━━━━━ 1s 4ms/step - accuracy: 0.7357 - loss: 0.5475 - val_accuracy: 0.7349 - val_loss: 0.5413 - val_pr_auc: 0.7856
Epoch 15/80
350/350 ━━━━━━━━━━━━━━━━━━━━ 1s 4ms/step - accuracy: 0.7360 - loss: 0.5470 - val_accuracy: 0.7342 - val_loss: 0.5409 - val_pr_auc: 0.7865
Epoch 16/80
350/350 ━━━━━━━━━━━━━━━━━━━━ 1s 4ms/step - accuracy: 0.7363 - loss: 0.5462 - val_accuracy: 0.7346 - val_loss: 0.5407 - val_pr_auc: 0.7857
Epoch 17/80
350/350 ━━━━━━━━━━━━━━━━━━━━ 1s 3ms/step - accuracy: 0.7365 - loss: 0.5465 - val_accuracy: 0.7338 - val_loss: 0.5409 - val_pr_auc: 0.7856
Epoch 18/80
350/350 ━━━━━━━━━━━━━━━━━━━━ 1s 4ms/step - accuracy: 0.7381 - loss: 0.5460 - val_accuracy: 0.7344 - val_loss: 0.5408 - val_pr_auc: 0.7856
Epoch 19/80
350/350 ━━━━━━━━━━━━━━━━━━━━ 1s 4ms/step - accuracy: 0.7368 - loss: 0.5458 - val_accuracy: 0.7344 - val_loss: 0.5410 - val_pr_auc: 0.7858
Epoch 20/80
350/350 ━━━━━━━━━━━━━━━━━━━━ 1s 4ms/step - accuracy: 0.7375 - loss: 0.5458 - val_accuracy: 0.7344 - val_loss: 0.5404 - val_pr_auc: 0.7863
Epoch 21/80
350/350 ━━━━━━━━━━━━━━━━━━━━ 1s 4ms/step - accuracy: 0.7375 - loss: 0.5442 - val_accuracy: 0.7355 - val_loss: 0.5403 - val_pr_auc: 0.7859
Epoch 22/80
350/350 ━━━━━━━━━━━━━━━━━━━━ 1s 4ms/step - accuracy: 0.7376 - loss: 0.5452 - val_accuracy: 0.7347 - val_loss: 0.5405 - val_pr_auc: 0.7855
Epoch 23/80
350/350 ━━━━━━━━━━━━━━━━━━━━ 1s 3ms/step - accuracy: 0.7376 - loss: 0.5438 - val_accuracy: 0.7339 - val_loss: 0.5405 - val_pr_auc: 0.7861
Epoch 24/80
350/350 ━━━━━━━━━━━━━━━━━━━━ 1s 4ms/step - accuracy: 0.7372 - loss: 0.5437 - val_accuracy: 0.7344 - val_loss: 0.5404 - val_pr_auc: 0.7863
2026-07-16 08:27:09 - HeartDisease_RiskDiscovery - INFO - TabNet training completed
2026-07-16 08:27:10 - HeartDisease_RiskDiscovery - INFO - TabNet weights saved to artifacts/Model/tabnet/fold_1/model.weights.h5 (weights only format: .weights.h5)
2026-07-16 08:27:11 - HeartDisease_RiskDiscovery - INFO - TabNet initialized: input_dim=19, params={'n_d': 12, 'n_a': 12, 'n_steps': 4, 'gamma': 1.625957341248133, 'lambda_sparse': 0.0005927172136384618, 'batch_size': 128, 'epochs': 80, 'lr': 0.0024260876636955963, 'dropout': 0.15580833938492766}
2026-07-16 08:27:11 - HeartDisease_RiskDiscovery - INFO - Training TabNet on 44794 samples
Epoch 1/80
/home/loint/Workings/InternalProjects/DataAnalysis/CardiovascularRiskDetectionSystem/.venv/lib/python3.10/site-packages/keras/src/optimizers/base_optimizer.py:870: UserWarning: Gradients do not exist for variables ['tab_net_model_2/tab_net_block_2/feature_transformer_10/dense_31/kernel', 'tab_net_model_2/tab_net_block_2/feature_transformer_10/batch_normalization_32/gamma', 'tab_net_model_2/tab_net_block_2/feature_transformer_10/batch_normalization_32/beta'] when minimizing the loss. If using `model.compile()`, did you forget to provide a `loss` argument?
  warnings.warn(
350/350 ━━━━━━━━━━━━━━━━━━━━ 6s 6ms/step - accuracy: 0.6923 - loss: 0.6104 - val_accuracy: 0.7309 - val_loss: 0.5469 - val_pr_auc: 0.7886
Epoch 2/80
350/350 ━━━━━━━━━━━━━━━━━━━━ 1s 3ms/step - accuracy: 0.7254 - loss: 0.5617 - val_accuracy: 0.7394 - val_loss: 0.5363 - val_pr_auc: 0.7935
Epoch 3/80
350/350 ━━━━━━━━━━━━━━━━━━━━ 1s 4ms/step - accuracy: 0.7288 - loss: 0.5573 - val_accuracy: 0.7405 - val_loss: 0.5347 - val_pr_auc: 0.7947
Epoch 4/80
350/350 ━━━━━━━━━━━━━━━━━━━━ 1s 4ms/step - accuracy: 0.7312 - loss: 0.5550 - val_accuracy: 0.7409 - val_loss: 0.5342 - val_pr_auc: 0.7954
Epoch 5/80
350/350 ━━━━━━━━━━━━━━━━━━━━ 1s 4ms/step - accuracy: 0.7307 - loss: 0.5529 - val_accuracy: 0.7419 - val_loss: 0.5334 - val_pr_auc: 0.7948
Epoch 6/80
350/350 ━━━━━━━━━━━━━━━━━━━━ 1s 4ms/step - accuracy: 0.7325 - loss: 0.5515 - val_accuracy: 0.7419 - val_loss: 0.5327 - val_pr_auc: 0.7947
Epoch 7/80
350/350 ━━━━━━━━━━━━━━━━━━━━ 1s 4ms/step - accuracy: 0.7333 - loss: 0.5500 - val_accuracy: 0.7425 - val_loss: 0.5322 - val_pr_auc: 0.7950
Epoch 8/80
350/350 ━━━━━━━━━━━━━━━━━━━━ 1s 4ms/step - accuracy: 0.7324 - loss: 0.5502 - val_accuracy: 0.7424 - val_loss: 0.5326 - val_pr_auc: 0.7949
Epoch 9/80
350/350 ━━━━━━━━━━━━━━━━━━━━ 1s 4ms/step - accuracy: 0.7323 - loss: 0.5494 - val_accuracy: 0.7431 - val_loss: 0.5324 - val_pr_auc: 0.7954
Epoch 10/80
350/350 ━━━━━━━━━━━━━━━━━━━━ 1s 4ms/step - accuracy: 0.7338 - loss: 0.5491 - val_accuracy: 0.7429 - val_loss: 0.5322 - val_pr_auc: 0.7951
Epoch 11/80
350/350 ━━━━━━━━━━━━━━━━━━━━ 1s 4ms/step - accuracy: 0.7335 - loss: 0.5486 - val_accuracy: 0.7427 - val_loss: 0.5321 - val_pr_auc: 0.7956
Epoch 12/80
350/350 ━━━━━━━━━━━━━━━━━━━━ 1s 4ms/step - accuracy: 0.7348 - loss: 0.5482 - val_accuracy: 0.7430 - val_loss: 0.5317 - val_pr_auc: 0.7960
Epoch 13/80
350/350 ━━━━━━━━━━━━━━━━━━━━ 1s 4ms/step - accuracy: 0.7343 - loss: 0.5485 - val_accuracy: 0.7432 - val_loss: 0.5316 - val_pr_auc: 0.7962
Epoch 14/80
350/350 ━━━━━━━━━━━━━━━━━━━━ 1s 4ms/step - accuracy: 0.7343 - loss: 0.5484 - val_accuracy: 0.7429 - val_loss: 0.5319 - val_pr_auc: 0.7965
Epoch 15/80
350/350 ━━━━━━━━━━━━━━━━━━━━ 1s 3ms/step - accuracy: 0.7339 - loss: 0.5478 - val_accuracy: 0.7443 - val_loss: 0.5311 - val_pr_auc: 0.7973
Epoch 16/80
350/350 ━━━━━━━━━━━━━━━━━━━━ 1s 4ms/step - accuracy: 0.7345 - loss: 0.5474 - val_accuracy: 0.7438 - val_loss: 0.5315 - val_pr_auc: 0.7977
Epoch 17/80
350/350 ━━━━━━━━━━━━━━━━━━━━ 1s 4ms/step - accuracy: 0.7363 - loss: 0.5471 - val_accuracy: 0.7440 - val_loss: 0.5312 - val_pr_auc: 0.7972
Epoch 18/80
350/350 ━━━━━━━━━━━━━━━━━━━━ 1s 4ms/step - accuracy: 0.7350 - loss: 0.5469 - val_accuracy: 0.7442 - val_loss: 0.5315 - val_pr_auc: 0.7973
Epoch 19/80
350/350 ━━━━━━━━━━━━━━━━━━━━ 1s 4ms/step - accuracy: 0.7351 - loss: 0.5468 - val_accuracy: 0.7423 - val_loss: 0.5313 - val_pr_auc: 0.7976
Epoch 20/80
350/350 ━━━━━━━━━━━━━━━━━━━━ 1s 4ms/step - accuracy: 0.7364 - loss: 0.5464 - val_accuracy: 0.7432 - val_loss: 0.5310 - val_pr_auc: 0.7982
Epoch 21/80
350/350 ━━━━━━━━━━━━━━━━━━━━ 1s 4ms/step - accuracy: 0.7353 - loss: 0.5469 - val_accuracy: 0.7440 - val_loss: 0