[I 2026-07-16 08:24:32,317] Trial 13 finished with value: 0.7755342067987456 and parameters: {'use_max_depth': True, 'max_depth': 7, 'use_max_features_cat': True, 'max_features': 'sqrt', 'n_estimators': 850, 'min_samples_leaf': 9}. Best is trial 0 with value: 0.7778898817289104.
Best trial: 0. Best value: 0.77789:  47%|███████████████████████████████████████████████████████████████▉                                                                         | 14/30 [00:44<00:38,  2.38s/it]2026-07-16 08:24:32 - HeartDisease_RiskDiscovery - INFO - RandomForest initialized with resolved params: {'n_estimators': 1200, 'max_depth': 21, 'max_features': 'sqrt', 'min_samples_leaf': 13, 'class_weight': 'balanced', 'random_state': 46, 'n_jobs': -1}
2026-07-16 08:24:32 - HeartDisease_RiskDiscovery - INFO - Training RandomForest on 44795 samples
2026-07-16 08:24:36 - HeartDisease_RiskDiscovery - INFO - RandomForest training completed
[I 2026-07-16 08:24:36,412] Trial 14 finished with value: 0.7762870273138001 and parameters: {'use_max_depth': True, 'max_depth': 21, 'use_max_features_cat': True, 'max_features': 'sqrt', 'n_estimators': 1200, 'min_samples_leaf': 13}. Best is trial 0 with value: 0.7778898817289104.
Best trial: 0. Best value: 0.77789:  50%|████████████████████████████████████████████████████████████████████▌                                                                    | 15/30 [00:48<00:43,  2.90s/it]2026-07-16 08:24:36 - HeartDisease_RiskDiscovery - INFO - RandomForest initialized with resolved params: {'n_estimators': 850, 'max_depth': 11, 'max_features': 'sqrt', 'min_samples_leaf': 7, 'class_weight': 'balanced', 'random_state': 46, 'n_jobs': -1}
2026-07-16 08:24:36 - HeartDisease_RiskDiscovery - INFO - Training RandomForest on 44795 samples
2026-07-16 08:24:38 - HeartDisease_RiskDiscovery - INFO - RandomForest training completed
[I 2026-07-16 08:24:38,677] Trial 15 finished with value: 0.7780556028707712 and parameters: {'use_max_depth': True, 'max_depth': 11, 'use_max_features_cat': True, 'max_features': 'sqrt', 'n_estimators': 850, 'min_samples_leaf': 7}. Best is trial 15 with value: 0.7780556028707712.
Best trial: 15. Best value: 0.778056:  53%|████████████████████████████████████████████████████████████████████████                                                               | 16/30 [00:50<00:37,  2.71s/it]2026-07-16 08:24:38 - HeartDisease_RiskDiscovery - INFO - RandomForest initialized with resolved params: {'n_estimators': 750, 'max_depth': 15, 'max_features': 'sqrt', 'min_samples_leaf': 7, 'class_weight': 'balanced', 'random_state': 46, 'n_jobs': -1}
2026-07-16 08:24:38 - HeartDisease_RiskDiscovery - INFO - Training RandomForest on 44795 samples
2026-07-16 08:24:40 - HeartDisease_RiskDiscovery - INFO - RandomForest training completed
[I 2026-07-16 08:24:40,996] Trial 16 finished with value: 0.7771380263057832 and parameters: {'use_max_depth': True, 'max_depth': 15, 'use_max_features_cat': True, 'max_features': 'sqrt', 'n_estimators': 750, 'min_samples_leaf': 7}. Best is trial 15 with value: 0.7780556028707712.
Best trial: 15. Best value: 0.778056:  57%|████████████████████████████████████████████████████████████████████████████▌                                                          | 17/30 [00:53<00:33,  2.59s/it]2026-07-16 08:24:41 - HeartDisease_RiskDiscovery - INFO - RandomForest initialized with resolved params: {'n_estimators': 1100, 'max_depth': 22, 'max_features': 'sqrt', 'min_samples_leaf': 5, 'class_weight': 'balanced', 'random_state': 46, 'n_jobs': -1}
2026-07-16 08:24:41 - HeartDisease_RiskDiscovery - INFO - Training RandomForest on 44795 samples
2026-07-16 08:24:44 - HeartDisease_RiskDiscovery - INFO - RandomForest training completed
[I 2026-07-16 08:24:44,798] Trial 17 finished with value: 0.7739017136092293 and parameters: {'use_max_depth': True, 'max_depth': 22, 'use_max_features_cat': True, 'max_features': 'sqrt', 'n_estimators': 1100, 'min_samples_leaf': 5}. Best is trial 15 with value: 0.7780556028707712.
Best trial: 15. Best value: 0.778056:  60%|█████████████████████████████████████████████████████████████████████████████████                                                      | 18/30 [00:56<00:35,  2.95s/it]2026-07-16 08:24:44 - HeartDisease_RiskDiscovery - INFO - RandomForest initialized with resolved params: {'n_estimators': 1300, 'max_depth': None, 'max_features': 'log2', 'min_samples_leaf': 7, 'class_weight': 'balanced', 'random_state': 46, 'n_jobs': -1}
2026-07-16 08:24:44 - HeartDisease_RiskDiscovery - INFO - Training RandomForest on 44795 samples
2026-07-16 08:24:48 - HeartDisease_RiskDiscovery - INFO - RandomForest training completed
[I 2026-07-16 08:24:49,089] Trial 18 finished with value: 0.774781164464457 and parameters: {'use_max_depth': False, 'use_max_features_cat': True, 'max_features': 'log2', 'n_estimators': 1300, 'min_samples_leaf': 7}. Best is trial 15 with value: 0.7780556028707712.
Best trial: 15. Best value: 0.778056:  63%|█████████████████████████████████████████████████████████████████████████████████████▌                                                 | 19/30 [01:01<00:36,  3.36s/it]2026-07-16 08:24:49 - HeartDisease_RiskDiscovery - INFO - RandomForest initialized with resolved params: {'n_estimators': 1000, 'max_depth': 10, 'max_features': 'sqrt', 'min_samples_leaf': 3, 'class_weight': 'balanced', 'random_state': 46, 'n_jobs': -1}
2026-07-16 08:24:49 - HeartDisease_RiskDiscovery - INFO - Training RandomForest on 44795 samples
2026-07-16 08:24:51 - HeartDisease_RiskDiscovery - INFO - RandomForest training completed
[I 2026-07-16 08:24:51,640] Trial 19 finished with value: 0.7778398210588029 and parameters: {'use_max_depth': True, 'max_depth': 10, 'use_max_features_cat': True, 'max_features': 'sqrt', 'n_estimators': 1000, 'min_samples_leaf': 3}. Best is trial 15 with value: 0.7780556028707712.
Best trial: 15. Best value: 0.778056:  67%|██████████████████████████████████████████████████████████████████████████████████████████                                             | 20/30 [01:03<00:31,  3.11s/it]2026-07-16 08:24:51 - HeartDisease_RiskDiscovery - INFO - RandomForest initialized with resolved params: {'n_estimators': 750, 'max_depth': 14, 'max_features': 'sqrt', 'min_samples_leaf': 12, 'class_weight': 'balanced', 'random_state': 46, 'n_jobs': -1}
2026-07-16 08:24:51 - HeartDisease_RiskDiscovery - INFO - Training RandomForest on 44795 samples
2026-07-16 08:24:53 - HeartDisease_RiskDiscovery - INFO - RandomForest training completed
[I 2026-07-16 08:24:53,833] Trial 20 finished with value: 0.7773299194479272 and parameters: {'use_max_depth': True, 'max_depth': 14, 'use_max_features_cat': True, 'max_features': 'sqrt', 'n_estimators': 750, 'min_samples_leaf': 12}. Best is trial 15 with value: 0.7780556028707712.
Best trial: 15. Best value: 0.778056:  70%|██████████████████████████████████████████████████████████████████████████████████████████████▌                                        | 21/30 [01:06<00:25,  2.84s/it]2026-07-16 08:24:53 - HeartDisease_RiskDiscovery - INFO - RandomForest initialized with resolved params: {'n_estimators': 1000, 'max_depth': 9, 'max_features': 'sqrt', 'min_samples_leaf': 1, 'class_weight': 'balanced', 'random_state': 46, 'n_jobs': -1}
2026-07-16 08:24:53 - HeartDisease_RiskDiscovery - INFO - Training RandomForest on 44795 samples
2026-07-16 08:24:56 - HeartDisease_RiskDiscovery - INFO - RandomForest training completed
[I 2026-07-16 08:24:56,264] Trial 21 finished with value: 0.7778869966321961 and parameters: {'use_max_depth': True, 'max_depth': 9, 'use_max_features_cat': True, 'max_features': 'sqrt', 'n_estimators': 1000, 'min_samples_leaf': 1}. Best is trial 15 with value: 0.7780556028707712.
Best trial: 15. Best value: 0.778056:  73%|███████████████████████████████████████████████████████████████████████████████████████████████████                                    | 22/30 [01:08<00:21,  2.72s/it]2026-07-16 08:24:56 - HeartDisease_RiskDiscovery - INFO - RandomForest initialized with resolved params: {'n_estimators': 1500, 'max_depth': 8, 'max_features': 'sqrt', 'min_samples_leaf': 1, 'class_weight': 'balanced', 'random_state': 46, 'n_jobs': -1}
2026-07-16 08:24:56 - HeartDisease_RiskDiscovery - INFO - Training RandomForest on 44795 samples
2026-07-16 08:24:59 - HeartDisease_RiskDiscovery - INFO - RandomForest training completed
[I 2026-07-16 08:24:59,733] Trial 22 finished with value: 0.7771659213584027 and parameters: {'use_max_depth': True, 'max_depth': 8, 'use_max_features_cat': True, 'max_features': 'sqrt', 'n_estimators': 1500, 'min_samples_leaf': 1}. Best is trial 15 with value: 0.7780556028707712.
Best trial: 15. Best value: 0.778056:  77%|███████████████████████████████████████████████████████████████████████████████████████████████████████▌                               | 23/30 [01:11<00:20,  2.94s/it]2026-07-16 08:24:59 - HeartDisease_RiskDiscovery - INFO - RandomForest initialized with resolved params: {'n_estimators': 1050, 'max_depth': 12, 'max_features': 'sqrt', 'min_samples_leaf': 3, 'class_weight': 'balanced', 'random_state': 46, 'n_jobs': -1}
2026-07-16 08:24:59 - HeartDisease_RiskDiscovery - INFO - Training RandomForest on 44795 samples
2026-07-16 08:25:02 - HeartDisease_RiskDiscovery - INFO - RandomForest training completed
[I 2026-07-16 08:25:02,739] Trial 23 finished with value: 0.7776576102384533 and parameters: {'use_max_depth': True, 'max_depth': 12, 'use_max_features_cat': True, 'max_features': 'sqrt', 'n_estimators': 1050, 'min_samples_leaf': 3}. Best is trial 15 with value: 0.7780556028707712.
Best trial: 15. Best value: 0.778056:  80%|████████████████████████████████████████████████████████████████████████████████████████████████████████████                           | 24/30 [01:14<00:17,  2.96s/it]2026-07-16 08:25:02 - HeartDisease_RiskDiscovery - INFO - RandomForest initialized with resolved params: {'n_estimators': 800, 'max_depth': 9, 'max_features': 'sqrt', 'min_samples_leaf': 8, 'class_weight': 'balanced', 'random_state': 46, 'n_jobs': -1}
2026-07-16 08:25:02 - HeartDisease_RiskDiscovery - INFO - Training RandomForest on 44795 samples
2026-07-16 08:25:04 - HeartDisease_RiskDiscovery - INFO - RandomForest training completed
[I 2026-07-16 08:25:05,058] Trial 24 finished with value: 0.7773814167099846 and parameters: {'use_max_depth': True, 'max_depth': 9, 'use_max_features_cat': True, 'max_features': 'sqrt', 'n_estimators': 800, 'min_samples_leaf': 8}. Best is trial 15 with value: 0.7780556028707712.
Best trial: 15. Best value: 0.778056:  83%|████████████████████████████████████████████████████████████████████████████████████████████████████████████████▌                      | 25/30 [01:17<00:13,  2.77s/it]2026-07-16 08:25:05 - HeartDisease_RiskDiscovery - INFO - RandomForest initialized with resolved params: {'n_estimators': 650, 'max_depth': 17, 'max_features': 'log2', 'min_samples_leaf': 15, 'class_weight': 'balanced', 'random_state': 46, 'n_jobs': -1}
2026-07-16 08:25:05 - HeartDisease_RiskDiscovery - INFO - Training RandomForest on 44795 samples
2026-07-16 08:25:06 - HeartDisease_RiskDiscovery - INFO - RandomForest training completed
[I 2026-07-16 08:25:07,000] Trial 25 finished with value: 0.7774234070861857 and parameters: {'use_max_depth': True, 'max_depth': 17, 'use_max_features_cat': True, 'max_features': 'log2', 'n_estimators': 650, 'min_samples_leaf': 15}. Best is trial 15 with value: 0.7780556028707712.
Best trial: 15. Best value: 0.778056:  87%|█████████████████████████████████████████████████████████████████████████████████████████████████████████████████████                  | 26/30 [01:19<00:10,  2.52s/it]2026-07-16 08:25:07 - HeartDisease_RiskDiscovery - INFO - RandomForest initialized with resolved params: {'n_estimators': 900, 'max_depth': None, 'max_features': 'sqrt', 'min_samples_leaf': 4, 'class_weight': 'balanced', 'random_state': 46, 'n_jobs': -1}
2026-07-16 08:25:07 - HeartDisease_RiskDiscovery - INFO - Training RandomForest on 44795 samples
2026-07-16 08:25:10 - HeartDisease_RiskDiscovery - INFO - RandomForest training completed
[I 2026-07-16 08:25:10,320] Trial 26 finished with value: 0.7721645626038237 and parameters: {'use_max_depth': False, 'use_max_features_cat': True, 'max_features': 'sqrt', 'n_estimators': 900, 'min_samples_leaf': 4}. Best is trial 15 with value: 0.7780556028707712.
Best trial: 15. Best value: 0.778056:  90%|█████████████████████████████████████████████████████████████████████████████████████████████████████████████████████████▌             | 27/30 [01:22<00:08,  2.76s/it]2026-07-16 08:25:10 - HeartDisease_RiskDiscovery - INFO - RandomForest initialized with resolved params: {'n_estimators': 1200, 'max_depth': 12, 'max_features': 'sqrt', 'min_samples_leaf': 2, 'class_weight': 'balanced', 'random_state': 46, 'n_jobs': -1}
2026-07-16 08:25:10 - HeartDisease_RiskDiscovery - INFO - Training RandomForest on 44795 samples
2026-07-16 08:25:13 - HeartDisease_RiskDiscovery - INFO - RandomForest training completed
[I 2026-07-16 08:25:13,762] Trial 27 finished with value: 0.7774912742180438 and parameters: {'use_max_depth': True, 'max_depth': 12, 'use_max_features_cat': True, 'max_features': 'sqrt', 'n_estimators': 1200, 'min_samples_leaf': 2}. Best is trial 15 with value: 0.7780556028707712.
Best trial: 15. Best value: 0.778056:  93%|██████████████████████████████████████████████████████████████████████████████████████████████████████████████████████████████         | 28/30 [01:25<00:05,  2.96s/it]2026-07-16 08:25:13 - HeartDisease_RiskDiscovery - INFO - RandomForest initialized with resolved params: {'n_estimators': 450, 'max_depth': 6, 'max_features': 'sqrt', 'min_samples_leaf': 8, 'class_weight': 'balanced', 'random_state': 46, 'n_jobs': -1}
2026-07-16 08:25:13 - HeartDisease_RiskDiscovery - INFO - Training RandomForest on 44795 samples
2026-07-16 08:25:14 - HeartDisease_RiskDiscovery - INFO - RandomForest training completed
[I 2026-07-16 08:25:14,715] Trial 28 finished with value: 0.774303978548702 and parameters: {'use_max_depth': True, 'max_depth': 6, 'use_max_features_cat': True, 'max_features': 'sqrt', 'n_estimators': 450, 'min_samples_leaf': 8}. Best is trial 15 with value: 0.7780556028707712.
Best trial: 15. Best value: 0.778056:  97%|██████████████████████████████████████████████████████████████████████████████████████████████████████████████████████████████████▌    | 29/30 [01:26<00:02,  2.36s/it]2026-07-16 08:25:14 - HeartDisease_RiskDiscovery - INFO - RandomForest initialized with resolved params: {'n_estimators': 550, 'max_depth': None, 'max_features': 'log2', 'min_samples_leaf': 6, 'class_weight': 'balanced', 'random_state': 46, 'n_jobs': -1}
2026-07-16 08:25:14 - HeartDisease_RiskDiscovery - INFO - Training RandomForest on 44795 samples
2026-07-16 08:25:16 - HeartDisease_RiskDiscovery - INFO - RandomForest training completed
