[I 2026-07-16 08:23:13,068] Trial 21 finished with value: 0.7818607598429147 and parameters: {'use_max_depth': True, 'max_depth': 9, 'use_max_features_cat': True, 'max_features': 'log2', 'n_estimators': 1300, 'min_samples_leaf': 11}. Best is trial 21 with value: 0.7818607598429147.
Best trial: 21. Best value: 0.781861:  73%|███████████████████████████████████████████████████████████████████████████████████████████████████                                    | 22/30 [01:12<00:25,  3.21s/it]2026-07-16 08:23:13 - HeartDisease_RiskDiscovery - INFO - RandomForest initialized with resolved params: {'n_estimators': 1300, 'max_depth': 10, 'max_features': 'log2', 'min_samples_leaf': 11, 'class_weight': 'balanced', 'random_state': 45, 'n_jobs': -1}
2026-07-16 08:23:13 - HeartDisease_RiskDiscovery - INFO - Training RandomForest on 44795 samples
2026-07-16 08:23:16 - HeartDisease_RiskDiscovery - INFO - RandomForest training completed
[I 2026-07-16 08:23:16,288] Trial 22 finished with value: 0.7816212994353017 and parameters: {'use_max_depth': True, 'max_depth': 10, 'use_max_features_cat': True, 'max_features': 'log2', 'n_estimators': 1300, 'min_samples_leaf': 11}. Best is trial 21 with value: 0.7818607598429147.
Best trial: 21. Best value: 0.781861:  77%|███████████████████████████████████████████████████████████████████████████████████████████████████████▌                               | 23/30 [01:15<00:22,  3.21s/it]2026-07-16 08:23:16 - HeartDisease_RiskDiscovery - INFO - RandomForest initialized with resolved params: {'n_estimators': 1300, 'max_depth': 14, 'max_features': 'log2', 'min_samples_leaf': 11, 'class_weight': 'balanced', 'random_state': 45, 'n_jobs': -1}
2026-07-16 08:23:16 - HeartDisease_RiskDiscovery - INFO - Training RandomForest on 44795 samples
2026-07-16 08:23:19 - HeartDisease_RiskDiscovery - INFO - RandomForest training completed
[I 2026-07-16 08:23:20,009] Trial 23 finished with value: 0.7807237126128012 and parameters: {'use_max_depth': True, 'max_depth': 14, 'use_max_features_cat': True, 'max_features': 'log2', 'n_estimators': 1300, 'min_samples_leaf': 11}. Best is trial 21 with value: 0.7818607598429147.
Best trial: 21. Best value: 0.781861:  80%|████████████████████████████████████████████████████████████████████████████████████████████████████████████                           | 24/30 [01:19<00:20,  3.37s/it]2026-07-16 08:23:20 - HeartDisease_RiskDiscovery - INFO - RandomForest initialized with resolved params: {'n_estimators': 1200, 'max_depth': 9, 'max_features': 'log2', 'min_samples_leaf': 11, 'class_weight': 'balanced', 'random_state': 45, 'n_jobs': -1}
2026-07-16 08:23:20 - HeartDisease_RiskDiscovery - INFO - Training RandomForest on 44795 samples
2026-07-16 08:23:22 - HeartDisease_RiskDiscovery - INFO - RandomForest training completed
[I 2026-07-16 08:23:22,906] Trial 24 finished with value: 0.7818560627123072 and parameters: {'use_max_depth': True, 'max_depth': 9, 'use_max_features_cat': True, 'max_features': 'log2', 'n_estimators': 1200, 'min_samples_leaf': 11}. Best is trial 21 with value: 0.7818607598429147.
Best trial: 21. Best value: 0.781861:  83%|████████████████████████████████████████████████████████████████████████████████████████████████████████████████▌                      | 25/30 [01:22<00:16,  3.23s/it]2026-07-16 08:23:22 - HeartDisease_RiskDiscovery - INFO - RandomForest initialized with resolved params: {'n_estimators': 1200, 'max_depth': 6, 'max_features': 'log2', 'min_samples_leaf': 9, 'class_weight': 'balanced', 'random_state': 45, 'n_jobs': -1}
2026-07-16 08:23:22 - HeartDisease_RiskDiscovery - INFO - Training RandomForest on 44795 samples
2026-07-16 08:23:25 - HeartDisease_RiskDiscovery - INFO - RandomForest training completed
[I 2026-07-16 08:23:25,408] Trial 25 finished with value: 0.780092465485362 and parameters: {'use_max_depth': True, 'max_depth': 6, 'use_max_features_cat': True, 'max_features': 'log2', 'n_estimators': 1200, 'min_samples_leaf': 9}. Best is trial 21 with value: 0.7818607598429147.
Best trial: 21. Best value: 0.781861:  87%|█████████████████████████████████████████████████████████████████████████████████████████████████████████████████████                  | 26/30 [01:24<00:12,  3.01s/it]2026-07-16 08:23:25 - HeartDisease_RiskDiscovery - INFO - RandomForest initialized with resolved params: {'n_estimators': 1400, 'max_depth': None, 'max_features': 'log2', 'min_samples_leaf': 13, 'class_weight': 'balanced', 'random_state': 45, 'n_jobs': -1}
2026-07-16 08:23:25 - HeartDisease_RiskDiscovery - INFO - Training RandomForest on 44795 samples
2026-07-16 08:23:29 - HeartDisease_RiskDiscovery - INFO - RandomForest training completed
[I 2026-07-16 08:23:30,048] Trial 26 finished with value: 0.7804190085735945 and parameters: {'use_max_depth': False, 'use_max_features_cat': True, 'max_features': 'log2', 'n_estimators': 1400, 'min_samples_leaf': 13}. Best is trial 21 with value: 0.7818607598429147.
Best trial: 21. Best value: 0.781861:  90%|█████████████████████████████████████████████████████████████████████████████████████████████████████████████████████████▌             | 27/30 [01:29<00:10,  3.50s/it]2026-07-16 08:23:30 - HeartDisease_RiskDiscovery - INFO - RandomForest initialized with resolved params: {'n_estimators': 1100, 'max_depth': 9, 'max_features': 'log2', 'min_samples_leaf': 11, 'class_weight': 'balanced', 'random_state': 45, 'n_jobs': -1}
2026-07-16 08:23:30 - HeartDisease_RiskDiscovery - INFO - Training RandomForest on 44795 samples
2026-07-16 08:23:32 - HeartDisease_RiskDiscovery - INFO - RandomForest training completed
[I 2026-07-16 08:23:32,667] Trial 27 finished with value: 0.7818315780914458 and parameters: {'use_max_depth': True, 'max_depth': 9, 'use_max_features_cat': True, 'max_features': 'log2', 'n_estimators': 1100, 'min_samples_leaf': 11}. Best is trial 21 with value: 0.7818607598429147.
Best trial: 21. Best value: 0.781861:  93%|██████████████████████████████████████████████████████████████████████████████████████████████████████████████████████████████         | 28/30 [01:32<00:06,  3.23s/it]2026-07-16 08:23:32 - HeartDisease_RiskDiscovery - INFO - RandomForest initialized with resolved params: {'n_estimators': 1100, 'max_depth': 8, 'max_features': 'sqrt', 'min_samples_leaf': 9, 'class_weight': 'balanced', 'random_state': 45, 'n_jobs': -1}
2026-07-16 08:23:32 - HeartDisease_RiskDiscovery - INFO - Training RandomForest on 44795 samples
2026-07-16 08:23:35 - HeartDisease_RiskDiscovery - INFO - RandomForest training completed
[I 2026-07-16 08:23:35,166] Trial 28 finished with value: 0.7817455946337797 and parameters: {'use_max_depth': True, 'max_depth': 8, 'use_max_features_cat': True, 'max_features': 'sqrt', 'n_estimators': 1100, 'min_samples_leaf': 9}. Best is trial 21 with value: 0.7818607598429147.
Best trial: 21. Best value: 0.781861:  97%|██████████████████████████████████████████████████████████████████████████████████████████████████████████████████████████████████▌    | 29/30 [01:34<00:03,  3.01s/it]2026-07-16 08:23:35 - HeartDisease_RiskDiscovery - INFO - RandomForest initialized with resolved params: {'n_estimators': 800, 'max_depth': 14, 'max_features': 0.9727305692191976, 'min_samples_leaf': 13, 'class_weight': 'balanced', 'random_state': 45, 'n_jobs': -1}
2026-07-16 08:23:35 - HeartDisease_RiskDiscovery - INFO - Training RandomForest on 44795 samples
2026-07-16 08:23:43 - HeartDisease_RiskDiscovery - INFO - RandomForest training completed
[I 2026-07-16 08:23:43,218] Trial 29 finished with value: 0.7787157054527153 and parameters: {'use_max_depth': True, 'max_depth': 14, 'use_max_features_cat': False, 'max_features_float': 0.9727305692191976, 'n_estimators': 800, 'min_samples_leaf': 13}. Best is trial 21 with value: 0.7818607598429147.
Best trial: 21. Best value: 0.781861: 100%|███████████████████████████████████████████████████████████████████████████████████████████████████████████████████████████████████████| 30/30 [01:42<00:00,  3.42s/it]
2026-07-16 08:23:43 - HeartDisease_RiskDiscovery - INFO - RandomForest initialized with resolved params: {'n_estimators': 1300, 'max_depth': 9, 'max_features': 'log2', 'min_samples_leaf': 11, 'class_weight': 'balanced', 'random_state': 45, 'n_jobs': -1}
2026-07-16 08:23:43 - HeartDisease_RiskDiscovery - INFO - Training RandomForest on 44795 samples
2026-07-16 08:23:46 - HeartDisease_RiskDiscovery - INFO - RandomForest training completed
2026-07-16 08:23:47 - HeartDisease_RiskDiscovery - INFO - Feature importance saved to artifacts/Model/rf/fold_3/feature_importance.json
2026-07-16 08:23:47 - HeartDisease_RiskDiscovery - INFO - RandomForest saved to artifacts/Model/rf/fold_3/model.joblib
[I 2026-07-16 08:23:47,806] A new study created in memory with name: no-name-ec55e1a9-e80e-41f4-96b1-65ebb79156e0
  0%|                                                                                                                                                                                      | 0/30 [00:00<?, ?it/s]2026-07-16 08:23:47 - HeartDisease_RiskDiscovery - INFO - RandomForest initialized with resolved params: {'n_estimators': 750, 'max_depth': 12, 'max_features': 'sqrt', 'min_samples_leaf': 14, 'class_weight': 'balanced', 'random_state': 46, 'n_jobs': -1}
2026-07-16 08:23:47 - HeartDisease_RiskDiscovery - INFO - Training RandomForest on 44795 samples
2026-07-16 08:23:49 - HeartDisease_RiskDiscovery - INFO - RandomForest training completed
[I 2026-07-16 08:23:49,852] Trial 0 finished with value: 0.7778898817289104 and parameters: {'use_max_depth': True, 'max_depth': 12, 'use_max_features_cat': True, 'max_features': 'sqrt', 'n_estimators': 750, 'min_samples_leaf': 14}. Best is trial 0 with value: 0.7778898817289104.
Best trial: 0. Best value: 0.77789:   3%|████▌                                                                                                                                     | 1/30 [00:02<00:59,  2.05s/it]2026-07-16 08:23:49 - HeartDisease_RiskDiscovery - INFO - RandomForest initialized with resolved params: {'n_estimators': 1350, 'max_depth': None, 'max_features': 0.7965735677550978, 'min_samples_leaf': 5, 'class_weight': 'balanced', 'random_state': 46, 'n_jobs': -1}
2026-07-16 08:23:49 - HeartDisease_RiskDiscovery - INFO - Training RandomForest on 44795 samples
2026-07-16 08:24:04 - HeartDisease_RiskDiscovery - INFO - RandomForest training completed
[I 2026-07-16 08:24:05,291] Trial 1 finished with value: 0.7655228087732506 and parameters: {'use_max_depth': False, 'use_max_features_cat': False, 'max_features_float': 0.7965735677550978, 'n_estimators': 1350, 'min_samples_leaf': 5}. Best is trial 0 with value: 0.7778898817289104.
Best trial: 0. Best value: 0.77789:   7%|█████████▏                                                                                                                                | 2/30 [00:17<04:37,  9.92s/it]2026-07-16 08:24:05 - HeartDisease_RiskDiscovery - INFO - RandomForest initialized with resolved params: {'n_estimators': 600, 'max_depth': None, 'max_features': 0.2287908348797606, 'min_samples_leaf': 1, 'class_weight': 'balanced', 'random_state': 46, 'n_jobs': -1}
2026-07-16 08:24:05 - HeartDisease_RiskDiscovery - INFO - Training RandomForest on 44795 samples
2026-07-16 08:24:08 - HeartDisease_RiskDiscovery - INFO - RandomForest training completed
[I 2026-07-16 08:24:08,600] Trial 2 finished with value: 0.7449133815419566 and parameters: {'use_max_depth': False, 'use_max_features_cat': False, 'max_features_float': 0.2287908348797606, 'n_estimators': 600, 'min_samples_leaf': 1}. Best is trial 0 with value: 0.7778898817289104.
Best trial: 0. Best value: 0.77789:  10%|█████████████▊                                                                                                                            | 3/30 [00:20<03:06,  6.90s/it]2026-07-16 08:24:08 - HeartDisease_RiskDiscovery - INFO - RandomForest initialized with resolved params: {'n_estimators': 250, 'max_depth': 30, 'max_features': 'log2', 'min_samples_leaf': 5, 'class_weight': 'balanced', 'random_state': 46, 'n_jobs': -1}
2026-07-16 08:24:08 - HeartDisease_RiskDiscovery - INFO - Training RandomForest on 44795 samples
2026-07-16 08:24:09 - HeartDisease_RiskDiscovery - INFO - RandomForest training completed
[I 2026-07-16 08:24:09,546] Trial 3 finished with value: 0.7735979129563317 and parameters: {'use_max_depth': True, 'max_depth': 30, 'use_max_features_cat': True, 'max_features': 'log2', 'n_estimators': 250, 'min_samples_leaf': 5}. Best is trial 0 with value: 0.7778898817289104.
Best trial: 0. Best value: 0.77789:  13%|██████████████████▍                                                                                                                       | 4/30 [00:21<01:58,  4.55s/it]2026-07-16 08:24:09 - HeartDisease_RiskDiscovery - INFO - RandomForest initialized with resolved params: {'n_estimators': 400, 'max_depth': None, 'max_features': 0.2720682049600345, 'min_samples_leaf': 11, 'class_weight': 'balanced', 'random_state': 46, 'n_jobs': -1}
2026-07-16 08:24:09 - HeartDisease_RiskDiscovery - INFO - Training RandomForest on 44795 samples
2026-07-16 08:24:10 - HeartDisease_RiskDiscovery - INFO - RandomForest training completed
[I 2026-07-16 08:24:11,028] Trial 4 finished with value: 0.7752719331383737 and parameters: {'use_max_depth': False, 'use_max_features_cat': False, 'max_features_float': 0.2720682049600345, 'n_estimators': 400, 'min_samples_leaf': 11}. Best is trial 0 with value: 0.7778898817289104.
Best trial: 0. Best value: 0.77789:  17%|███████████████████████                                                                                                                   | 5/30 [00:23<01:26,  3.44s/it]2026-07-16 08:24:11 - HeartDisease_RiskDiscovery - INFO - RandomForest initialized with resolved params: {'n_estimators': 500, 'max_depth': 28, 'max_features': 0.2516823024718606, 'min_samples_leaf': 3, 'class_weight': 'balanced', 'random_state': 46, 'n_jobs': -1}
2026-07-16 08:24:11 - HeartDisease_RiskDiscovery - INFO - Training RandomForest on 44795 samples
2026-07-16 08:24:13 - HeartDisease_RiskDiscovery - INFO - RandomForest training completed
[I 2026-07-16 08:24:13,338] Trial 5 finished with value: 0.7693573907014346 and parameters: {'use_max_depth': True, 'max_depth': 28, 'use_max_features_cat': False, 'max_features_float': 0.2516823024718606, 'n_estimators': 500, 'min_samples_leaf': 3}. Best is trial 0 with value: 0.7778898817289104.
Best trial: 0. Best value: 0.77789:  20%|███████████████████████████▌                                                                                                              | 6/30 [00:25<01:13,  3.06s/it]2026-07-16 08:24:13 - HeartDisease_RiskDiscovery - INFO - RandomForest initialized with resolved params: {'n_estimators': 300, 'max_depth': 19, 'max_features': 0.3109687392104967, 'min_samples_leaf': 7, 'class_weight': 'balanced', 'random_state': 46, 'n_jobs': -1}
2026-07-16 08:24:13 - HeartDisease_RiskDiscovery - INFO - Training RandomForest on 44795 samples
2026-07-16 08:24:14 - HeartDisease_RiskDiscovery - INFO - RandomForest training completed
[I 2026-07-16 08:24:15,043] Trial 6 finished with value: 0.77538751605743 and parameters: {'use_max_depth': True, 'max_depth': 19, 'use_max_features_cat': False, 'max_features_float': 0.3109687392104967, 'n_estimators': 300, 'min_samples_leaf': 7}. Best is trial 0 with value: 0.7778898817289104.
Best trial: 0. Best value: 0.77789:  23%|████████████████████████████████▏                                                                                                         | 7/30 [00:27<01:00,  2.62s/it]2026-07-16 08:24:15 - HeartDisease_RiskDiscovery - INFO - RandomForest initialized with resolved params: {'n_estimators': 350, 'max_depth': None, 'max_features': 0.7586750740318822, 'min_samples_leaf': 14, 'class_weight': 'balanced', 'random_state': 46, 'n_jobs': -1}
2026-07-16 08:24:15 - HeartDisease_RiskDiscovery - INFO - Training RandomForest on 44795 samples
2026-07-16 08:24:18 - HeartDisease_RiskDiscovery - INFO - RandomForest training completed
[I 2026-07-16 08:24:18,255] Trial 7 finished with value: 0.7734164533285297 and parameters: {'use_max_depth': False, 'use_max_features_cat': False, 'max_features_float': 0.7586750740318822, 'n_estimators': 350, 'min_samples_leaf': 14}. Best is trial 0 with value: 0.7778898817289104.
Best trial: 0. Best value: 0.77789:  27%|████████████████████████████████████▊                                                                                                     | 8/30 [00:30<01:01,  2.81s/it]2026-07-16 08:24:18 - HeartDisease_RiskDiscovery - INFO - RandomForest initialized with resolved params: {'n_estimators': 700, 'max_depth': 6, 'max_features': 0.47664274214242663, 'min_samples_leaf': 13, 'class_weight': 'balanced', 'random_state': 46, 'n_jobs': -1}
2026-07-16 08:24:18 - HeartDisease_RiskDiscovery - INFO - Training RandomForest on 44795 samples
2026-07-16 08:24:20 - HeartDisease_RiskDiscovery - INFO - RandomForest training completed
[I 2026-07-16 08:24:20,545] Trial 8 finished with value: 0.7771354868275839 and parameters: {'use_max_depth': True, 'max_depth': 6, 'use_max_features_cat': False, 'max_features_float': 0.47664274214242663, 'n_estimators': 700, 'min_samples_leaf': 13}. Best is trial 0 with value: 0.7778898817289104.
Best trial: 0. Best value: 0.77789:  30%|█████████████████████████████████████████▍                                                                                                | 9/30 [00:32<00:55,  2.64s/it]2026-07-16 08:24:20 - HeartDisease_RiskDiscovery - INFO - RandomForest initialized with resolved params: {'n_estimators': 600, 'max_depth': 11, 'max_features': 'log2', 'min_samples_leaf': 10, 'class_weight': 'balanced', 'random_state': 46, 'n_jobs': -1}
2026-07-16 08:24:20 - HeartDisease_RiskDiscovery - INFO - Training RandomForest on 44795 samples
2026-07-16 08:24:22 - HeartDisease_RiskDiscovery - INFO - RandomForest training completed
[I 2026-07-16 08:24:22,152] Trial 9 finished with value: 0.7775075208210452 and parameters: {'use_max_depth': True, 'max_depth': 11, 'use_max_features_cat': True, 'max_features': 'log2', 'n_estimators': 600, 'min_samples_leaf': 10}. Best is trial 0 with value: 0.7778898817289104.
Best trial: 0. Best value: 0.77789:  33%|█████████████████████████████████████████████▋                                                                                           | 10/30 [00:34<00:46,  2.32s/it]2026-07-16 08:24:22 - HeartDisease_RiskDiscovery - INFO - RandomForest initialized with resolved params: {'n_estimators': 1100, 'max_depth': 16, 'max_features': 'sqrt', 'min_samples_leaf': 15, 'class_weight': 'balanced', 'random_state': 46, 'n_jobs': -1}
2026-07-16 08:24:22 - HeartDisease_RiskDiscovery - INFO - Training RandomForest on 44795 samples
2026-07-16 08:24:25 - HeartDisease_RiskDiscovery - INFO - RandomForest training completed
[I 2026-07-16 08:24:25,359] Trial 10 finished with value: 0.7772086542580872 and parameters: {'use_max_depth': True, 'max_depth': 16, 'use_max_features_cat': True, 'max_features': 'sqrt', 'n_estimators': 1100, 'min_samples_leaf': 15}. Best is trial 0 with value: 0.7778898817289104.
Best trial: 0. Best value: 0.77789:  37%|██████████████████████████████████████████████████▏                                                                                      | 11/30 [00:37<00:49,  2.59s/it]2026-07-16 08:24:25 - HeartDisease_RiskDiscovery - INFO - RandomForest initialized with resolved params: {'n_estimators': 900, 'max_depth': 10, 'max_features': 'sqrt', 'min_samples_leaf': 10, 'class_weight': 'balanced', 'random_state': 46, 'n_jobs': -1}
2026-07-16 08:24:25 - HeartDisease_RiskDiscovery - INFO - Training RandomForest on 44795 samples
2026-07-16 08:24:27 - HeartDisease_RiskDiscovery - INFO - RandomForest training completed
[I 2026-07-16 08:24:27,648] Trial 11 finished with value: 0.7776242137340424 and parameters: {'use_max_depth': True, 'max_depth': 10, 'use_max_features_cat': True, 'max_features': 'sqrt', 'n_estimators': 900, 'min_samples_leaf': 10}. Best is trial 0 with value: 0.7778898817289104.
Best trial: 0. Best value: 0.77789:  40%|██████████████████████████████████████████████████████▊                                                                                  | 12/30 [00:39<00:45,  2.50s/it]2026-07-16 08:24:27 - HeartDisease_RiskDiscovery - INFO - RandomForest initialized with resolved params: {'n_estimators': 950, 'max_depth': 13, 'max_features': 'sqrt', 'min_samples_leaf': 11, 'class_weight': 'balanced', 'random_state': 46, 'n_jobs': -1}
2026-07-16 08:24:27 - HeartDisease_RiskDiscovery - INFO - Training RandomForest on 44795 samples
2026-07-16 08:24:30 - HeartDisease_RiskDiscovery - INFO - RandomForest training completed
[I 2026-07-16 08:24:30,381] Trial 12 finished with value: 0.7774329263948031 and parameters: {'use_max_depth': True, 'max_depth': 13, 'use_max_features_cat': True, 'max_features': 'sqrt', 'n_estimators': 950, 'min_samples_leaf': 11}. Best is trial 0 with value: 0.7778898817289104.
Best trial: 0. Best value: 0.77789:  43%|███████████████████████████████████████████████████████████▎                                                                             | 13/30 [00:42<00:43,  2.57s/it]2026-07-16 08:24:30 - HeartDisease_RiskDiscovery - INFO - RandomForest initialized with resolved params: {'n_estimators': 850, 'max_depth': 7, 'max_features': 'sqrt', 'min_samples_leaf': 9, 'class_weight': 'balanced', 'random_state': 46, 'n_jobs': -1}
2026-07-16 08:24:30 - HeartDisease_RiskDiscovery - INFO - Training RandomForest on 44795 samples
2026-07-16 08:24:32 - HeartDisease_RiskDiscovery - INFO - RandomForest training completed
