[I 2026-07-16 08:18:30,189] Trial 23 finished with value: 0.7791198844966936 and parameters: {'use_max_depth': True, 'max_depth': 24, 'use_max_features_cat': True, 'max_features': 'sqrt', 'n_estimators': 900, 'min_samples_leaf': 14}. Best is trial 18 with value: 0.7796040663822508.
Best trial: 18. Best value: 0.779604:  80%|██████████████████████████████████████████████████████████████████████████████████████████████████████▍                         | 24/30 [01:18<00:17,  2.93s/it]2026-07-16 08:18:30 - HeartDisease_RiskDiscovery - INFO - RandomForest initialized with resolved params: {'n_estimators': 300, 'max_depth': None, 'max_features': 'sqrt', 'min_samples_leaf': 14, 'class_weight': 'balanced', 'random_state': 42, 'n_jobs': -1}
2026-07-16 08:18:30 - HeartDisease_RiskDiscovery - INFO - Training RandomForest on 44794 samples
2026-07-16 08:18:31 - HeartDisease_RiskDiscovery - INFO - RandomForest training completed
[I 2026-07-16 08:18:31,315] Trial 24 finished with value: 0.7795217201552614 and parameters: {'use_max_depth': False, 'use_max_features_cat': True, 'max_features': 'sqrt', 'n_estimators': 300, 'min_samples_leaf': 14}. Best is trial 18 with value: 0.7796040663822508.
Best trial: 18. Best value: 0.779604:  83%|██████████████████████████████████████████████████████████████████████████████████████████████████████████▋                     | 25/30 [01:19<00:11,  2.39s/it]2026-07-16 08:18:31 - HeartDisease_RiskDiscovery - INFO - RandomForest initialized with resolved params: {'n_estimators': 750, 'max_depth': None, 'max_features': 'sqrt', 'min_samples_leaf': 12, 'class_weight': 'balanced', 'random_state': 42, 'n_jobs': -1}
2026-07-16 08:18:31 - HeartDisease_RiskDiscovery - INFO - Training RandomForest on 44794 samples
2026-07-16 08:18:33 - HeartDisease_RiskDiscovery - INFO - RandomForest training completed
[I 2026-07-16 08:18:34,125] Trial 25 finished with value: 0.7793396512793047 and parameters: {'use_max_depth': False, 'use_max_features_cat': True, 'max_features': 'sqrt', 'n_estimators': 750, 'min_samples_leaf': 12}. Best is trial 18 with value: 0.7796040663822508.
Best trial: 18. Best value: 0.779604:  87%|██████████████████████████████████████████████████████████████████████████████████████████████████████████████▉                 | 26/30 [01:22<00:10,  2.52s/it]2026-07-16 08:18:34 - HeartDisease_RiskDiscovery - INFO - RandomForest initialized with resolved params: {'n_estimators': 350, 'max_depth': 23, 'max_features': 0.5314125488418378, 'min_samples_leaf': 14, 'class_weight': 'balanced', 'random_state': 42, 'n_jobs': -1}
2026-07-16 08:18:34 - HeartDisease_RiskDiscovery - INFO - Training RandomForest on 44794 samples
2026-07-16 08:18:36 - HeartDisease_RiskDiscovery - INFO - RandomForest training completed
[I 2026-07-16 08:18:36,859] Trial 26 finished with value: 0.7769139670898647 and parameters: {'use_max_depth': True, 'max_depth': 23, 'use_max_features_cat': False, 'max_features_float': 0.5314125488418378, 'n_estimators': 350, 'min_samples_leaf': 14}. Best is trial 18 with value: 0.7796040663822508.
Best trial: 18. Best value: 0.779604:  90%|███████████████████████████████████████████████████████████████████████████████████████████████████████████████████▏            | 27/30 [01:25<00:07,  2.58s/it]2026-07-16 08:18:36 - HeartDisease_RiskDiscovery - INFO - RandomForest initialized with resolved params: {'n_estimators': 500, 'max_depth': None, 'max_features': 'sqrt', 'min_samples_leaf': 11, 'class_weight': 'balanced', 'random_state': 42, 'n_jobs': -1}
2026-07-16 08:18:36 - HeartDisease_RiskDiscovery - INFO - Training RandomForest on 44794 samples
2026-07-16 08:18:38 - HeartDisease_RiskDiscovery - INFO - RandomForest training completed
[I 2026-07-16 08:18:38,789] Trial 27 finished with value: 0.778825829125381 and parameters: {'use_max_depth': False, 'use_max_features_cat': True, 'max_features': 'sqrt', 'n_estimators': 500, 'min_samples_leaf': 11}. Best is trial 18 with value: 0.7796040663822508.
Best trial: 18. Best value: 0.779604:  93%|███████████████████████████████████████████████████████████████████████████████████████████████████████████████████████▍        | 28/30 [01:27<00:04,  2.39s/it]2026-07-16 08:18:38 - HeartDisease_RiskDiscovery - INFO - RandomForest initialized with resolved params: {'n_estimators': 1000, 'max_depth': 13, 'max_features': 'sqrt', 'min_samples_leaf': 14, 'class_weight': 'balanced', 'random_state': 42, 'n_jobs': -1}
2026-07-16 08:18:38 - HeartDisease_RiskDiscovery - INFO - Training RandomForest on 44794 samples
2026-07-16 08:18:41 - HeartDisease_RiskDiscovery - INFO - RandomForest training completed
[I 2026-07-16 08:18:41,647] Trial 28 finished with value: 0.7795314705377481 and parameters: {'use_max_depth': True, 'max_depth': 13, 'use_max_features_cat': True, 'max_features': 'sqrt', 'n_estimators': 1000, 'min_samples_leaf': 14}. Best is trial 18 with value: 0.7796040663822508.
Best trial: 18. Best value: 0.779604:  97%|███████████████████████████████████████████████████████████████████████████████████████████████████████████████████████████▋    | 29/30 [01:30<00:02,  2.53s/it]2026-07-16 08:18:41 - HeartDisease_RiskDiscovery - INFO - RandomForest initialized with resolved params: {'n_estimators': 1000, 'max_depth': 14, 'max_features': 'sqrt', 'min_samples_leaf': 13, 'class_weight': 'balanced', 'random_state': 42, 'n_jobs': -1}
2026-07-16 08:18:41 - HeartDisease_RiskDiscovery - INFO - Training RandomForest on 44794 samples
2026-07-16 08:18:44 - HeartDisease_RiskDiscovery - INFO - RandomForest training completed
[I 2026-07-16 08:18:44,598] Trial 29 finished with value: 0.7792001072538663 and parameters: {'use_max_depth': True, 'max_depth': 14, 'use_max_features_cat': True, 'max_features': 'sqrt', 'n_estimators': 1000, 'min_samples_leaf': 13}. Best is trial 18 with value: 0.7796040663822508.
Best trial: 18. Best value: 0.779604: 100%|████████████████████████████████████████████████████████████████████████████████████████████████████████████████████████████████| 30/30 [01:33<00:00,  3.10s/it]
2026-07-16 08:18:44 - HeartDisease_RiskDiscovery - INFO - RandomForest initialized with resolved params: {'n_estimators': 950, 'max_depth': 19, 'max_features': 'sqrt', 'min_samples_leaf': 15, 'class_weight': 'balanced', 'random_state': 42, 'n_jobs': -1}
2026-07-16 08:18:44 - HeartDisease_RiskDiscovery - INFO - Training RandomForest on 44794 samples
2026-07-16 08:18:47 - HeartDisease_RiskDiscovery - INFO - RandomForest training completed
2026-07-16 08:18:48 - HeartDisease_RiskDiscovery - INFO - Feature importance saved to artifacts/Model/rf/fold_0/feature_importance.json
2026-07-16 08:18:48 - HeartDisease_RiskDiscovery - INFO - RandomForest saved to artifacts/Model/rf/fold_0/model.joblib
[I 2026-07-16 08:18:48,879] A new study created in memory with name: no-name-b4696d17-3456-4f7f-a019-4ccbdaed7734
  0%|                                                                                                                                                                                      | 0/30 [00:00<?, ?it/s]2026-07-16 08:18:48 - HeartDisease_RiskDiscovery - INFO - RandomForest initialized with resolved params: {'n_estimators': 1350, 'max_depth': None, 'max_features': 0.46171124464891183, 'min_samples_leaf': 10, 'class_weight': 'balanced', 'random_state': 43, 'n_jobs': -1}
2026-07-16 08:18:48 - HeartDisease_RiskDiscovery - INFO - Training RandomForest on 44794 samples
2026-07-16 08:18:57 - HeartDisease_RiskDiscovery - INFO - RandomForest training completed
[I 2026-07-16 08:18:57,400] Trial 0 finished with value: 0.7793845709936046 and parameters: {'use_max_depth': False, 'use_max_features_cat': False, 'max_features_float': 0.46171124464891183, 'n_estimators': 1350, 'min_samples_leaf': 10}. Best is trial 0 with value: 0.7793845709936046.
Best trial: 0. Best value: 0.779385:   3%|████▌                                                                                                                                    | 1/30 [00:08<04:07,  8.52s/it]2026-07-16 08:18:57 - HeartDisease_RiskDiscovery - INFO - RandomForest initialized with resolved params: {'n_estimators': 250, 'max_depth': 24, 'max_features': 0.4035369006879035, 'min_samples_leaf': 13, 'class_weight': 'balanced', 'random_state': 43, 'n_jobs': -1}
2026-07-16 08:18:57 - HeartDisease_RiskDiscovery - INFO - Training RandomForest on 44794 samples
2026-07-16 08:18:58 - HeartDisease_RiskDiscovery - INFO - RandomForest training completed
[I 2026-07-16 08:18:58,710] Trial 1 finished with value: 0.7810503148786823 and parameters: {'use_max_depth': True, 'max_depth': 24, 'use_max_features_cat': False, 'max_features_float': 0.4035369006879035, 'n_estimators': 250, 'min_samples_leaf': 13}. Best is trial 1 with value: 0.7810503148786823.
Best trial: 1. Best value: 0.78105:   7%|█████████▏                                                                                                                                | 2/30 [00:09<01:59,  4.28s/it]2026-07-16 08:18:58 - HeartDisease_RiskDiscovery - INFO - RandomForest initialized with resolved params: {'n_estimators': 1500, 'max_depth': None, 'max_features': 'log2', 'min_samples_leaf': 6, 'class_weight': 'balanced', 'random_state': 43, 'n_jobs': -1}
2026-07-16 08:18:58 - HeartDisease_RiskDiscovery - INFO - Training RandomForest on 44794 samples
2026-07-16 08:19:03 - HeartDisease_RiskDiscovery - INFO - RandomForest training completed
[I 2026-07-16 08:19:03,793] Trial 2 finished with value: 0.7805625732381231 and parameters: {'use_max_depth': False, 'use_max_features_cat': True, 'max_features': 'log2', 'n_estimators': 1500, 'min_samples_leaf': 6}. Best is trial 1 with value: 0.7810503148786823.
Best trial: 1. Best value: 0.78105:  10%|█████████████▊                                                                                                                            | 3/30 [00:14<02:05,  4.65s/it]2026-07-16 08:19:03 - HeartDisease_RiskDiscovery - INFO - RandomForest initialized with resolved params: {'n_estimators': 550, 'max_depth': 22, 'max_features': 0.43840280055101016, 'min_samples_leaf': 1, 'class_weight': 'balanced', 'random_state': 43, 'n_jobs': -1}
2026-07-16 08:19:03 - HeartDisease_RiskDiscovery - INFO - Training RandomForest on 44794 samples
2026-07-16 08:19:07 - HeartDisease_RiskDiscovery - INFO - RandomForest training completed
[I 2026-07-16 08:19:07,941] Trial 3 finished with value: 0.7656541999294095 and parameters: {'use_max_depth': True, 'max_depth': 22, 'use_max_features_cat': False, 'max_features_float': 0.43840280055101016, 'n_estimators': 550, 'min_samples_leaf': 1}. Best is trial 1 with value: 0.7810503148786823.
Best trial: 1. Best value: 0.78105:  13%|██████████████████▍                                                                                                                       | 4/30 [00:19<01:55,  4.45s/it]2026-07-16 08:19:07 - HeartDisease_RiskDiscovery - INFO - RandomForest initialized with resolved params: {'n_estimators': 300, 'max_depth': 21, 'max_features': 'sqrt', 'min_samples_leaf': 3, 'class_weight': 'balanced', 'random_state': 43, 'n_jobs': -1}
2026-07-16 08:19:07 - HeartDisease_RiskDiscovery - INFO - Training RandomForest on 44794 samples
2026-07-16 08:19:09 - HeartDisease_RiskDiscovery - INFO - RandomForest training completed
[I 2026-07-16 08:19:09,332] Trial 4 finished with value: 0.7786666189574003 and parameters: {'use_max_depth': True, 'max_depth': 21, 'use_max_features_cat': True, 'max_features': 'sqrt', 'n_estimators': 300, 'min_samples_leaf': 3}. Best is trial 1 with value: 0.7810503148786823.
Best trial: 1. Best value: 0.78105:  17%|███████████████████████                                                                                                                   | 5/30 [00:20<01:23,  3.35s/it]2026-07-16 08:19:09 - HeartDisease_RiskDiscovery - INFO - RandomForest initialized with resolved params: {'n_estimators': 450, 'max_depth': 27, 'max_features': 'log2', 'min_samples_leaf': 7, 'class_weight': 'balanced', 'random_state': 43, 'n_jobs': -1}
2026-07-16 08:19:09 - HeartDisease_RiskDiscovery - INFO - Training RandomForest on 44794 samples
2026-07-16 08:19:10 - HeartDisease_RiskDiscovery - INFO - RandomForest training completed
[I 2026-07-16 08:19:11,037] Trial 5 finished with value: 0.7805434207508819 and parameters: {'use_max_depth': True, 'max_depth': 27, 'use_max_features_cat': True, 'max_features': 'log2', 'n_estimators': 450, 'min_samples_leaf': 7}. Best is trial 1 with value: 0.7810503148786823.
Best trial: 1. Best value: 0.78105:  20%|███████████████████████████▌                                                                                                              | 6/30 [00:22<01:06,  2.79s/it]2026-07-16 08:19:11 - HeartDisease_RiskDiscovery - INFO - RandomForest initialized with resolved params: {'n_estimators': 1100, 'max_depth': 17, 'max_features': 'sqrt', 'min_samples_leaf': 11, 'class_weight': 'balanced', 'random_state': 43, 'n_jobs': -1}
2026-07-16 08:19:11 - HeartDisease_RiskDiscovery - INFO - Training RandomForest on 44794 samples
2026-07-16 08:19:14 - HeartDisease_RiskDiscovery - INFO - RandomForest training completed
[I 2026-07-16 08:19:14,343] Trial 6 finished with value: 0.7823855538220896 and parameters: {'use_max_depth': True, 'max_depth': 17, 'use_max_features_cat': True, 'max_features': 'sqrt', 'n_estimators': 1100, 'min_samples_leaf': 11}. Best is trial 6 with value: 0.7823855538220896.
Best trial: 6. Best value: 0.782386:  23%|███████████████████████████████▉                                                                                                         | 7/30 [00:25<01:08,  2.96s/it]2026-07-16 08:19:14 - HeartDisease_RiskDiscovery - INFO - RandomForest initialized with resolved params: {'n_estimators': 1050, 'max_depth': 11, 'max_features': 0.4322662222166053, 'min_samples_leaf': 5, 'class_weight': 'balanced', 'random_state': 43, 'n_jobs': -1}
2026-07-16 08:19:14 - HeartDisease_RiskDiscovery - INFO - Training RandomForest on 44794 samples
2026-07-16 08:19:18 - HeartDisease_RiskDiscovery - INFO - RandomForest training completed
[I 2026-07-16 08:19:19,015] Trial 7 finished with value: 0.7835504861671571 and parameters: {'use_max_depth': True, 'max_depth': 11, 'use_max_features_cat': False, 'max_features_float': 0.4322662222166053, 'n_estimators': 1050, 'min_samples_leaf': 5}. Best is trial 7 with value: 0.7835504861671571.
Best trial: 7. Best value: 0.78355:  27%|████████████████████████████████████▊                                                                                                     | 8/30 [00:30<01:17,  3.50s/it]2026-07-16 08:19:19 - HeartDisease_RiskDiscovery - INFO - RandomForest initialized with resolved params: {'n_estimators': 1200, 'max_depth': None, 'max_features': 'sqrt', 'min_samples_leaf': 11, 'class_weight': 'balanced', 'random_state': 43, 'n_jobs': -1}
2026-07-16 08:19:19 - HeartDisease_RiskDiscovery - INFO - Training RandomForest on 44794 samples
2026-07-16 08:19:22 - HeartDisease_RiskDiscovery - INFO - RandomForest training completed
[I 2026-07-16 08:19:22,747] Trial 8 finished with value: 0.7820416022121829 and parameters: {'use_max_depth': False, 'use_max_features_cat': True, 'max_features': 'sqrt', 'n_estimators': 1200, 'min_samples_leaf': 11}. Best is trial 7 with value: 0.7835504861671571.
Best trial: 7. Best value: 0.78355:  30%|█████████████████████████████████████████▍                                                                                                | 9/30 [00:33<01:15,  3.57s/it]2026-07-16 08:19:22 - HeartDisease_RiskDiscovery - INFO - RandomForest initialized with resolved params: {'n_estimators': 1000, 'max_depth': 29, 'max_features': 0.3588639075490512, 'min_samples_leaf': 15, 'class_weight': 'balanced', 'random_state': 43, 'n_jobs': -1}
2026-07-16 08:19:22 - HeartDisease_RiskDiscovery - INFO - Training RandomForest on 44794 samples
2026-07-16 08:19:27 - HeartDisease_RiskDiscovery - INFO - RandomForest training completed
[I 2026-07-16 08:19:27,208] Trial 9 finished with value: 0.7816972334850222 and parameters: {'use_max_depth': True, 'max_depth': 29, 'use_max_features_cat': False, 'max_features_float': 0.3588639075490512, 'n_estimators': 1000, 'min_samples_leaf': 15}. Best is trial 7 with value: 0.7835504861671571.
Best trial: 7. Best value: 0.78355:  33%|█████████████████████████████████████████████▋                                                                                           | 10/30 [00:38<01:16,  3.85s/it]2026-07-16 08:19:27 - HeartDisease_RiskDiscovery - INFO - RandomForest initialized with resolved params: {'n_estimators': 800, 'max_depth': None, 'max_features': 0.896170030062679, 'min_samples_leaf': 4, 'class_weight': 'balanced', 'random_state': 43, 'n_jobs': -1}
2026-07-16 08:19:27 - HeartDisease_RiskDiscovery - INFO - Training RandomForest on 44794 samples
2026-07-16 08:19:37 - HeartDisease_RiskDiscovery - INFO - RandomForest training completed
[I 2026-07-16 08:19:37,950] Trial 10 finished with value: 0.768640953855959 and parameters: {'use_max_depth': False, 'use_max_features_cat': False, 'max_features_float': 0.896170030062679, 'n_estimators': 800, 'min_samples_leaf': 4}. Best is trial 7 with value: 0.7835504861671571.
Best trial: 7. Best value: 0.78355:  37%|██████████████████████████████████████████████████▏                                                                                      | 11/30 [00:49<01:53,  5.96s/it]2026-07-16 08:19:37 - HeartDisease_RiskDiscovery - INFO - RandomForest initialized with resolved params: {'n_estimators': 1000, 'max_depth': 10, 'max_features': 'sqrt', 'min_samples_leaf': 9, 'class_weight': 'balanced', 'random_state': 43, 'n_jobs': -1}
2026-07-16 08:19:37 - HeartDisease_RiskDiscovery - INFO - Training RandomForest on 44794 samples
2026-07-16 08:19:40 - HeartDisease_RiskDiscovery - INFO - RandomForest training completed
[I 2026-07-16 08:19:40,478] Trial 11 finished with value: 0.7839440030113902 and parameters: {'use_max_depth': True, 'max_depth': 10, 'use_max_features_cat': True, 'max_features': 'sqrt', 'n_estimators': 1000, 'min_samples_leaf': 9}. Best is trial 11 with value: 0.7839440030113902.
Best trial: 11. Best value: 0.783944:  40%|██████████████████████████████████████████████████████                                                                                 | 12/30 [00:51<01:28,  4.91s/it]2026-07-16 08:19:40 - HeartDisease_RiskDiscovery - INFO - RandomForest initialized with resolved params: {'n_estimators': 750, 'max_depth': 8, 'max_features': 0.7840850866687878, 'min_samples_leaf': 8, 'class_weight': 'balanced', 'random_state': 43, 'n_jobs': -1}
2026-07-16 08:19:40 - HeartDisease_RiskDiscovery - INFO - Training RandomForest on 44794 samples
2026-07-16 08:19:44 - HeartDisease_RiskDiscovery - INFO - RandomForest training completed
[I 2026-07-16 08:19:44,901] Trial 12 finished with value: 0.7836583045441045 and parameters: {'use_max_depth': True, 'max_depth': 8, 'use_max_features_cat': False, 'max_features_float': 0.7840850866687878, 'n_estimators': 750, 'min_samples_leaf': 8}. Best is trial 11 with value: 0.7839440030113902.
Best trial: 11. Best value: 0.783944:  43%|██████████████████████████████████████████████████████████▌                                                                            | 13/30 [00:56<01:21,  4.77s/it]2026-07-16 08:19:44 - HeartDisease_RiskDiscovery - INFO - RandomForest initialized with resolved params: {'n_estimators': 750, 'max_depth': 6, 'max_features': 'sqrt', 'min_samples_leaf': 9, 'class_weight': 'balanced', 'random_state': 43, 'n_jobs': -1}
2026-07-16 08:19:44 - HeartDisease_RiskDiscovery - INFO - Training RandomForest on 44794 samples
2026-07-16 08:19:46 - HeartDisease_RiskDiscovery - INFO - RandomForest training completed
[I 2026-07-16 08:19:46,465] Trial 13 finished with value: 0.780429151625363 and parameters: {'use_max_depth': True, 'max_depth': 6, 'use_max_features_cat': True, 'max_features': 'sqrt', 'n_estimators': 750, 'min_samples_leaf': 9}. Best is trial 11 with value: 0.7839440030113902.
Best trial: 11. Best value: 0.783944:  47%|███████████████████████████████████████████████████████████████                                                                        | 14/30 [00:57<01:00,  3.80s/it]2026-07-16 08:19:46 - HeartDisease_RiskDiscovery - INFO - RandomForest initialized with resolved params: {'n_estimators': 650, 'max_depth': 12, 'max_features': 'sqrt', 'min_samples_leaf': 8, 'class_weight': 'balanced', 'random_state': 43, 'n_jobs': -1}
2026-07-16 08:19:46 - HeartDisease_RiskDiscovery - INFO - Training RandomForest on 44794 samples
2026-07-16 08:19:48 - HeartDisease_RiskDiscovery - INFO - RandomForest training completed
[I 2026-07-16 08:19:48,310] Trial 14 finished with value: 0.7834085671857967 and parameters: {'use_max_depth': True, 'max_depth': 12, 'use_max_features_cat': True, 'max_features': 'sqrt', 'n_estimators': 650, 'min_samples_leaf': 8}. Best is trial 11 with value: 0.7839440030113902.
Best trial: 11. Best value: 0.783944:  50%|███████████████████████████████████████████████████████████████████▌                                                                   | 15/30 [00:59<00:48,  3.21s/it]2026-07-16 08:19:48 - HeartDisease_RiskDiscovery - INFO - RandomForest initialized with resolved params: {'n_estimators': 950, 'max_depth': 6, 'max_features': 0.7787638913512168, 'min_samples_leaf': 13, 'class_weight': 'balanced', 'random_state': 43, 'n_jobs': -1}
2026-07-16 08:19:48 - HeartDisease_RiskDiscovery - INFO - Training RandomForest on 44794 samples
2026-07-16 08:19:53 - HeartDisease_RiskDiscovery - INFO - RandomForest training completed
